
 /----------------------------------------------------------------------------\
 |                                                                            |
 |  yosys -- Yosys Open SYnthesis Suite                                       |
 |                                                                            |
 |  Copyright (C) 2012 - 2020  Claire Xenia Wolf <claire@yosyshq.com>         |
 |                                                                            |
 |  Permission to use, copy, modify, and/or distribute this software for any  |
 |  purpose with or without fee is hereby granted, provided that the above    |
 |  copyright notice and this permission notice appear in all copies.         |
 |                                                                            |
 |  THE SOFTWARE IS PROVIDED "AS IS" AND THE AUTHOR DISCLAIMS ALL WARRANTIES  |
 |  WITH REGARD TO THIS SOFTWARE INCLUDING ALL IMPLIED WARRANTIES OF          |
 |  MERCHANTABILITY AND FITNESS. IN NO EVENT SHALL THE AUTHOR BE LIABLE FOR   |
 |  ANY SPECIAL, DIRECT, INDIRECT, OR CONSEQUENTIAL DAMAGES OR ANY DAMAGES    |
 |  WHATSOEVER RESULTING FROM LOSS OF USE, DATA OR PROFITS, WHETHER IN AN     |
 |  ACTION OF CONTRACT, NEGLIGENCE OR OTHER TORTIOUS ACTION, ARISING OUT OF   |
 |  OR IN CONNECTION WITH THE USE OR PERFORMANCE OF THIS SOFTWARE.            |
 |                                                                            |
 \----------------------------------------------------------------------------/

 Yosys 0.10+12 (git sha1 72fac04, gcc 7.4.0-1ubuntu1~16.04~ppa1 -fPIC -Os)


-- Executing script file `out.ys' --

1. Executing Verilog-2005 frontend: /home/zhigang/raw_data/raw_designs/vtr_designs/verilog/koios/tiny_darknet_like.medium_submodules/td_fused_top_dataflow_in_loop_TOP_LOOP48462_accum1_out_0_memcore.v
Parsing SystemVerilog input from `/home/zhigang/raw_data/raw_designs/vtr_designs/verilog/koios/tiny_darknet_like.medium_submodules/td_fused_top_dataflow_in_loop_TOP_LOOP48462_accum1_out_0_memcore.v' to AST representation.
Generating RTLIL representation for module `\td_fused_top_dataflow_in_loop_TOP_LOOP48462_accum1_out_0_memcore'.
Generating RTLIL representation for module `\td_fused_top_dataflow_in_loop_TOP_LOOP48462_accum1_out_0_memcore_ram'.
Successfully finished Verilog frontend.

2. Executing HIERARCHY pass (managing design hierarchy).

2.1. Finding top of design hierarchy..
root of   0 design levels: td_fused_top_dataflow_in_loop_TOP_LOOP48462_accum1_out_0_memcore_ram
root of   1 design levels: td_fused_top_dataflow_in_loop_TOP_LOOP48462_accum1_out_0_memcore
Automatically selected td_fused_top_dataflow_in_loop_TOP_LOOP48462_accum1_out_0_memcore as design top module.

2.2. Analyzing design hierarchy..
Top module:  \td_fused_top_dataflow_in_loop_TOP_LOOP48462_accum1_out_0_memcore
Used module:     \td_fused_top_dataflow_in_loop_TOP_LOOP48462_accum1_out_0_memcore_ram

2.3. Analyzing design hierarchy..
Top module:  \td_fused_top_dataflow_in_loop_TOP_LOOP48462_accum1_out_0_memcore
Used module:     \td_fused_top_dataflow_in_loop_TOP_LOOP48462_accum1_out_0_memcore_ram
Removed 0 unused modules.

3. Executing PROC pass (convert processes to netlists).

3.1. Executing PROC_CLEAN pass (remove empty switches from decision trees).
Cleaned up 0 empty switches.

3.2. Executing PROC_RMDEAD pass (remove dead branches from decision trees).
Marked 2 switch rules as full_case in process $proc$/home/zhigang/raw_data/raw_designs/vtr_designs/verilog/koios/tiny_darknet_like.medium_submodules/td_fused_top_dataflow_in_loop_TOP_LOOP48462_accum1_out_0_memcore.v:91$14 in module td_fused_top_dataflow_in_loop_TOP_LOOP48462_accum1_out_0_memcore_ram.
Marked 2 switch rules as full_case in process $proc$/home/zhigang/raw_data/raw_designs/vtr_designs/verilog/koios/tiny_darknet_like.medium_submodules/td_fused_top_dataflow_in_loop_TOP_LOOP48462_accum1_out_0_memcore.v:81$3 in module td_fused_top_dataflow_in_loop_TOP_LOOP48462_accum1_out_0_memcore_ram.
Removed a total of 0 dead cases.

3.3. Executing PROC_PRUNE pass (remove redundant assignments in processes).
Removed 0 redundant assignments.
Promoted 6 assignments to connections.

3.4. Executing PROC_INIT pass (extract init attributes).

3.5. Executing PROC_ARST pass (detect async resets in processes).

3.6. Executing PROC_MUX pass (convert decision trees to multiplexers).
Creating decoders for process `\td_fused_top_dataflow_in_loop_TOP_LOOP48462_accum1_out_0_memcore_ram.$proc$/home/zhigang/raw_data/raw_designs/vtr_designs/verilog/koios/tiny_darknet_like.medium_submodules/td_fused_top_dataflow_in_loop_TOP_LOOP48462_accum1_out_0_memcore.v:91$14'.
     1/6: $2$memwr$\ram$/home/zhigang/raw_data/raw_designs/vtr_designs/verilog/koios/tiny_darknet_like.medium_submodules/td_fused_top_dataflow_in_loop_TOP_LOOP48462_accum1_out_0_memcore.v:95$2_EN[15:0]$23
     2/6: $2$memwr$\ram$/home/zhigang/raw_data/raw_designs/vtr_designs/verilog/koios/tiny_darknet_like.medium_submodules/td_fused_top_dataflow_in_loop_TOP_LOOP48462_accum1_out_0_memcore.v:95$2_DATA[15:0]$22
     3/6: $2$memwr$\ram$/home/zhigang/raw_data/raw_designs/vtr_designs/verilog/koios/tiny_darknet_like.medium_submodules/td_fused_top_dataflow_in_loop_TOP_LOOP48462_accum1_out_0_memcore.v:95$2_ADDR[2:0]$21
     4/6: $1$memwr$\ram$/home/zhigang/raw_data/raw_designs/vtr_designs/verilog/koios/tiny_darknet_like.medium_submodules/td_fused_top_dataflow_in_loop_TOP_LOOP48462_accum1_out_0_memcore.v:95$2_EN[15:0]$20
     5/6: $1$memwr$\ram$/home/zhigang/raw_data/raw_designs/vtr_designs/verilog/koios/tiny_darknet_like.medium_submodules/td_fused_top_dataflow_in_loop_TOP_LOOP48462_accum1_out_0_memcore.v:95$2_DATA[15:0]$19
     6/6: $1$memwr$\ram$/home/zhigang/raw_data/raw_designs/vtr_designs/verilog/koios/tiny_darknet_like.medium_submodules/td_fused_top_dataflow_in_loop_TOP_LOOP48462_accum1_out_0_memcore.v:95$2_ADDR[2:0]$18
Creating decoders for process `\td_fused_top_dataflow_in_loop_TOP_LOOP48462_accum1_out_0_memcore_ram.$proc$/home/zhigang/raw_data/raw_designs/vtr_designs/verilog/koios/tiny_darknet_like.medium_submodules/td_fused_top_dataflow_in_loop_TOP_LOOP48462_accum1_out_0_memcore.v:81$3'.
     1/7: $2$memwr$\ram$/home/zhigang/raw_data/raw_designs/vtr_designs/verilog/koios/tiny_darknet_like.medium_submodules/td_fused_top_dataflow_in_loop_TOP_LOOP48462_accum1_out_0_memcore.v:85$1_EN[15:0]$12
     2/7: $2$memwr$\ram$/home/zhigang/raw_data/raw_designs/vtr_designs/verilog/koios/tiny_darknet_like.medium_submodules/td_fused_top_dataflow_in_loop_TOP_LOOP48462_accum1_out_0_memcore.v:85$1_DATA[15:0]$11
     3/7: $2$memwr$\ram$/home/zhigang/raw_data/raw_designs/vtr_designs/verilog/koios/tiny_darknet_like.medium_submodules/td_fused_top_dataflow_in_loop_TOP_LOOP48462_accum1_out_0_memcore.v:85$1_ADDR[2:0]$10
     4/7: $1$memwr$\ram$/home/zhigang/raw_data/raw_designs/vtr_designs/verilog/koios/tiny_darknet_like.medium_submodules/td_fused_top_dataflow_in_loop_TOP_LOOP48462_accum1_out_0_memcore.v:85$1_EN[15:0]$9
     5/7: $1$memwr$\ram$/home/zhigang/raw_data/raw_designs/vtr_designs/verilog/koios/tiny_darknet_like.medium_submodules/td_fused_top_dataflow_in_loop_TOP_LOOP48462_accum1_out_0_memcore.v:85$1_DATA[15:0]$8
     6/7: $1$memwr$\ram$/home/zhigang/raw_data/raw_designs/vtr_designs/verilog/koios/tiny_darknet_like.medium_submodules/td_fused_top_dataflow_in_loop_TOP_LOOP48462_accum1_out_0_memcore.v:85$1_ADDR[2:0]$7
     7/7: $0\q0[15:0]

3.7. Executing PROC_DLATCH pass (convert process syncs to latches).

3.8. Executing PROC_DFF pass (convert process syncs to FFs).
Creating register for signal `\td_fused_top_dataflow_in_loop_TOP_LOOP48462_accum1_out_0_memcore_ram.$memwr$\ram$/home/zhigang/raw_data/raw_designs/vtr_designs/verilog/koios/tiny_darknet_like.medium_submodules/td_fused_top_dataflow_in_loop_TOP_LOOP48462_accum1_out_0_memcore.v:95$2_ADDR' using process `\td_fused_top_dataflow_in_loop_TOP_LOOP48462_accum1_out_0_memcore_ram.$proc$/home/zhigang/raw_data/raw_designs/vtr_designs/verilog/koios/tiny_darknet_like.medium_submodules/td_fused_top_dataflow_in_loop_TOP_LOOP48462_accum1_out_0_memcore.v:91$14'.
  created $dff cell `$procdff$81' with positive edge clock.
Creating register for signal `\td_fused_top_dataflow_in_loop_TOP_LOOP48462_accum1_out_0_memcore_ram.$memwr$\ram$/home/zhigang/raw_data/raw_designs/vtr_designs/verilog/koios/tiny_darknet_like.medium_submodules/td_fused_top_dataflow_in_loop_TOP_LOOP48462_accum1_out_0_memcore.v:95$2_DATA' using process `\td_fused_top_dataflow_in_loop_TOP_LOOP48462_accum1_out_0_memcore_ram.$proc$/home/zhigang/raw_data/raw_designs/vtr_designs/verilog/koios/tiny_darknet_like.medium_submodules/td_fused_top_dataflow_in_loop_TOP_LOOP48462_accum1_out_0_memcore.v:91$14'.
  created $dff cell `$procdff$82' with positive edge clock.
Creating register for signal `\td_fused_top_dataflow_in_loop_TOP_LOOP48462_accum1_out_0_memcore_ram.$memwr$\ram$/home/zhigang/raw_data/raw_designs/vtr_designs/verilog/koios/tiny_darknet_like.medium_submodules/td_fused_top_dataflow_in_loop_TOP_LOOP48462_accum1_out_0_memcore.v:95$2_EN' using process `\td_fused_top_dataflow_in_loop_TOP_LOOP48462_accum1_out_0_memcore_ram.$proc$/home/zhigang/raw_data/raw_designs/vtr_designs/verilog/koios/tiny_darknet_like.medium_submodules/td_fused_top_dataflow_in_loop_TOP_LOOP48462_accum1_out_0_memcore.v:91$14'.
  created $dff cell `$procdff$83' with positive edge clock.
Creating register for signal `\td_fused_top_dataflow_in_loop_TOP_LOOP48462_accum1_out_0_memcore_ram.\q0' using process `\td_fused_top_dataflow_in_loop_TOP_LOOP48462_accum1_out_0_memcore_ram.$proc$/home/zhigang/raw_data/raw_designs/vtr_designs/verilog/koios/tiny_darknet_like.medium_submodules/td_fused_top_dataflow_in_loop_TOP_LOOP48462_accum1_out_0_memcore.v:81$3'.
  created $dff cell `$procdff$84' with positive edge clock.
Creating register for signal `\td_fused_top_dataflow_in_loop_TOP_LOOP48462_accum1_out_0_memcore_ram.$memwr$\ram$/home/zhigang/raw_data/raw_designs/vtr_designs/verilog/koios/tiny_darknet_like.medium_submodules/td_fused_top_dataflow_in_loop_TOP_LOOP48462_accum1_out_0_memcore.v:85$1_ADDR' using process `\td_fused_top_dataflow_in_loop_TOP_LOOP48462_accum1_out_0_memcore_ram.$proc$/home/zhigang/raw_data/raw_designs/vtr_designs/verilog/koios/tiny_darknet_like.medium_submodules/td_fused_top_dataflow_in_loop_TOP_LOOP48462_accum1_out_0_memcore.v:81$3'.
  created $dff cell `$procdff$85' with positive edge clock.
Creating register for signal `\td_fused_top_dataflow_in_loop_TOP_LOOP48462_accum1_out_0_memcore_ram.$memwr$\ram$/home/zhigang/raw_data/raw_designs/vtr_designs/verilog/koios/tiny_darknet_like.medium_submodules/td_fused_top_dataflow_in_loop_TOP_LOOP48462_accum1_out_0_memcore.v:85$1_DATA' using process `\td_fused_top_dataflow_in_loop_TOP_LOOP48462_accum1_out_0_memcore_ram.$proc$/home/zhigang/raw_data/raw_designs/vtr_designs/verilog/koios/tiny_darknet_like.medium_submodules/td_fused_top_dataflow_in_loop_TOP_LOOP48462_accum1_out_0_memcore.v:81$3'.
  created $dff cell `$procdff$86' with positive edge clock.
Creating register for signal `\td_fused_top_dataflow_in_loop_TOP_LOOP48462_accum1_out_0_memcore_ram.$memwr$\ram$/home/zhigang/raw_data/raw_designs/vtr_designs/verilog/koios/tiny_darknet_like.medium_submodules/td_fused_top_dataflow_in_loop_TOP_LOOP48462_accum1_out_0_memcore.v:85$1_EN' using process `\td_fused_top_dataflow_in_loop_TOP_LOOP48462_accum1_out_0_memcore_ram.$proc$/home/zhigang/raw_data/raw_designs/vtr_designs/verilog/koios/tiny_darknet_like.medium_submodules/td_fused_top_dataflow_in_loop_TOP_LOOP48462_accum1_out_0_memcore.v:81$3'.
  created $dff cell `$procdff$87' with positive edge clock.

3.9. Executing PROC_MEMWR pass (convert process memory writes to cells).

3.10. Executing PROC_CLEAN pass (remove empty switches from decision trees).
Found and cleaned up 2 empty switches in `\td_fused_top_dataflow_in_loop_TOP_LOOP48462_accum1_out_0_memcore_ram.$proc$/home/zhigang/raw_data/raw_designs/vtr_designs/verilog/koios/tiny_darknet_like.medium_submodules/td_fused_top_dataflow_in_loop_TOP_LOOP48462_accum1_out_0_memcore.v:91$14'.
Removing empty process `td_fused_top_dataflow_in_loop_TOP_LOOP48462_accum1_out_0_memcore_ram.$proc$/home/zhigang/raw_data/raw_designs/vtr_designs/verilog/koios/tiny_darknet_like.medium_submodules/td_fused_top_dataflow_in_loop_TOP_LOOP48462_accum1_out_0_memcore.v:91$14'.
Found and cleaned up 2 empty switches in `\td_fused_top_dataflow_in_loop_TOP_LOOP48462_accum1_out_0_memcore_ram.$proc$/home/zhigang/raw_data/raw_designs/vtr_designs/verilog/koios/tiny_darknet_like.medium_submodules/td_fused_top_dataflow_in_loop_TOP_LOOP48462_accum1_out_0_memcore.v:81$3'.
Removing empty process `td_fused_top_dataflow_in_loop_TOP_LOOP48462_accum1_out_0_memcore_ram.$proc$/home/zhigang/raw_data/raw_designs/vtr_designs/verilog/koios/tiny_darknet_like.medium_submodules/td_fused_top_dataflow_in_loop_TOP_LOOP48462_accum1_out_0_memcore.v:81$3'.
Cleaned up 4 empty switches.

3.11. Executing OPT_EXPR pass (perform const folding).
Optimizing module td_fused_top_dataflow_in_loop_TOP_LOOP48462_accum1_out_0_memcore_ram.
Optimizing module td_fused_top_dataflow_in_loop_TOP_LOOP48462_accum1_out_0_memcore.

4. Executing OPT pass (performing simple optimizations).

4.1. Executing OPT_EXPR pass (perform const folding).
Optimizing module td_fused_top_dataflow_in_loop_TOP_LOOP48462_accum1_out_0_memcore_ram.
Optimizing module td_fused_top_dataflow_in_loop_TOP_LOOP48462_accum1_out_0_memcore.

4.2. Executing OPT_MERGE pass (detect identical cells).
Finding identical cells in module `\td_fused_top_dataflow_in_loop_TOP_LOOP48462_accum1_out_0_memcore_ram'.
Finding identical cells in module `\td_fused_top_dataflow_in_loop_TOP_LOOP48462_accum1_out_0_memcore'.
Removed a total of 0 cells.

4.3. Executing OPT_MUXTREE pass (detect dead branches in mux trees).
Running muxtree optimizer on module \td_fused_top_dataflow_in_loop_TOP_LOOP48462_accum1_out_0_memcore_ram..
  Creating internal representation of mux trees.
  Evaluating internal representation of mux trees.
  Analyzing evaluation results.
    dead port 2/2 on $mux $procmux$67.
    dead port 2/2 on $mux $procmux$61.
    dead port 2/2 on $mux $procmux$55.
    dead port 2/2 on $mux $procmux$40.
    dead port 2/2 on $mux $procmux$34.
    dead port 2/2 on $mux $procmux$28.
Running muxtree optimizer on module \td_fused_top_dataflow_in_loop_TOP_LOOP48462_accum1_out_0_memcore..
  Creating internal representation of mux trees.
  No muxes found in this module.
Removed 6 multiplexer ports.
<suppressed ~7 debug messages>

4.4. Executing OPT_REDUCE pass (consolidate $*mux and $reduce_* inputs).
  Optimizing cells in module \td_fused_top_dataflow_in_loop_TOP_LOOP48462_accum1_out_0_memcore_ram.
    Consolidated identical input bits for $mux cell $procmux$53:
      Old ports: A=16'0000000000000000, B=16'1111111111111111, Y=$procmux$53_Y
      New ports: A=1'0, B=1'1, Y=$procmux$53_Y [0]
      New connections: $procmux$53_Y [15:1] = { $procmux$53_Y [0] $procmux$53_Y [0] $procmux$53_Y [0] $procmux$53_Y [0] $procmux$53_Y [0] $procmux$53_Y [0] $procmux$53_Y [0] $procmux$53_Y [0] $procmux$53_Y [0] $procmux$53_Y [0] $procmux$53_Y [0] $procmux$53_Y [0] $procmux$53_Y [0] $procmux$53_Y [0] $procmux$53_Y [0] }
    Consolidated identical input bits for $mux cell $procmux$26:
      Old ports: A=16'0000000000000000, B=16'1111111111111111, Y=$procmux$26_Y
      New ports: A=1'0, B=1'1, Y=$procmux$26_Y [0]
      New connections: $procmux$26_Y [15:1] = { $procmux$26_Y [0] $procmux$26_Y [0] $procmux$26_Y [0] $procmux$26_Y [0] $procmux$26_Y [0] $procmux$26_Y [0] $procmux$26_Y [0] $procmux$26_Y [0] $procmux$26_Y [0] $procmux$26_Y [0] $procmux$26_Y [0] $procmux$26_Y [0] $procmux$26_Y [0] $procmux$26_Y [0] $procmux$26_Y [0] }
  Optimizing cells in module \td_fused_top_dataflow_in_loop_TOP_LOOP48462_accum1_out_0_memcore_ram.
    Consolidated identical input bits for $mux cell $procmux$70:
      Old ports: A=16'0000000000000000, B=$procmux$53_Y, Y=$procmux$70_Y
      New ports: A=1'0, B=$procmux$53_Y [0], Y=$procmux$70_Y [0]
      New connections: $procmux$70_Y [15:1] = { $procmux$70_Y [0] $procmux$70_Y [0] $procmux$70_Y [0] $procmux$70_Y [0] $procmux$70_Y [0] $procmux$70_Y [0] $procmux$70_Y [0] $procmux$70_Y [0] $procmux$70_Y [0] $procmux$70_Y [0] $procmux$70_Y [0] $procmux$70_Y [0] $procmux$70_Y [0] $procmux$70_Y [0] $procmux$70_Y [0] }
    Consolidated identical input bits for $mux cell $procmux$43:
      Old ports: A=16'0000000000000000, B=$procmux$26_Y, Y=$procmux$43_Y
      New ports: A=1'0, B=$procmux$26_Y [0], Y=$procmux$43_Y [0]
      New connections: $procmux$43_Y [15:1] = { $procmux$43_Y [0] $procmux$43_Y [0] $procmux$43_Y [0] $procmux$43_Y [0] $procmux$43_Y [0] $procmux$43_Y [0] $procmux$43_Y [0] $procmux$43_Y [0] $procmux$43_Y [0] $procmux$43_Y [0] $procmux$43_Y [0] $procmux$43_Y [0] $procmux$43_Y [0] $procmux$43_Y [0] $procmux$43_Y [0] }
  Optimizing cells in module \td_fused_top_dataflow_in_loop_TOP_LOOP48462_accum1_out_0_memcore_ram.
  Optimizing cells in module \td_fused_top_dataflow_in_loop_TOP_LOOP48462_accum1_out_0_memcore.
Performed a total of 4 changes.

4.5. Executing OPT_MERGE pass (detect identical cells).
Finding identical cells in module `\td_fused_top_dataflow_in_loop_TOP_LOOP48462_accum1_out_0_memcore_ram'.
Finding identical cells in module `\td_fused_top_dataflow_in_loop_TOP_LOOP48462_accum1_out_0_memcore'.
Removed a total of 0 cells.

4.6. Executing OPT_DFF pass (perform DFF optimizations).
Adding EN signal on $procdff$84 ($dff) from module td_fused_top_dataflow_in_loop_TOP_LOOP48462_accum1_out_0_memcore_ram (D = $memrd$\ram$/home/zhigang/raw_data/raw_designs/vtr_designs/verilog/koios/tiny_darknet_like.medium_submodules/td_fused_top_dataflow_in_loop_TOP_LOOP48462_accum1_out_0_memcore.v:86$13_DATA, Q = \q0).

4.7. Executing OPT_CLEAN pass (remove unused cells and wires).
Finding unused cells or wires in module \td_fused_top_dataflow_in_loop_TOP_LOOP48462_accum1_out_0_memcore_ram..
Finding unused cells or wires in module \td_fused_top_dataflow_in_loop_TOP_LOOP48462_accum1_out_0_memcore..
Removed 7 unused cells and 51 unused wires.
<suppressed ~8 debug messages>

4.8. Executing OPT_EXPR pass (perform const folding).
Optimizing module td_fused_top_dataflow_in_loop_TOP_LOOP48462_accum1_out_0_memcore.
Optimizing module td_fused_top_dataflow_in_loop_TOP_LOOP48462_accum1_out_0_memcore_ram.

4.9. Rerunning OPT passes. (Maybe there is more to do..)

4.10. Executing OPT_MUXTREE pass (detect dead branches in mux trees).
Running muxtree optimizer on module \td_fused_top_dataflow_in_loop_TOP_LOOP48462_accum1_out_0_memcore..
  Creating internal representation of mux trees.
  No muxes found in this module.
Running muxtree optimizer on module \td_fused_top_dataflow_in_loop_TOP_LOOP48462_accum1_out_0_memcore_ram..
  Creating internal representation of mux trees.
  Evaluating internal representation of mux trees.
  Analyzing evaluation results.
Removed 0 multiplexer ports.
<suppressed ~6 debug messages>

4.11. Executing OPT_REDUCE pass (consolidate $*mux and $reduce_* inputs).
  Optimizing cells in module \td_fused_top_dataflow_in_loop_TOP_LOOP48462_accum1_out_0_memcore.
  Optimizing cells in module \td_fused_top_dataflow_in_loop_TOP_LOOP48462_accum1_out_0_memcore_ram.
Performed a total of 0 changes.

4.12. Executing OPT_MERGE pass (detect identical cells).
Finding identical cells in module `\td_fused_top_dataflow_in_loop_TOP_LOOP48462_accum1_out_0_memcore'.
Finding identical cells in module `\td_fused_top_dataflow_in_loop_TOP_LOOP48462_accum1_out_0_memcore_ram'.
Removed a total of 0 cells.

4.13. Executing OPT_DFF pass (perform DFF optimizations).

4.14. Executing OPT_CLEAN pass (remove unused cells and wires).
Finding unused cells or wires in module \td_fused_top_dataflow_in_loop_TOP_LOOP48462_accum1_out_0_memcore..
Finding unused cells or wires in module \td_fused_top_dataflow_in_loop_TOP_LOOP48462_accum1_out_0_memcore_ram..

4.15. Executing OPT_EXPR pass (perform const folding).
Optimizing module td_fused_top_dataflow_in_loop_TOP_LOOP48462_accum1_out_0_memcore.
Optimizing module td_fused_top_dataflow_in_loop_TOP_LOOP48462_accum1_out_0_memcore_ram.

4.16. Finished OPT passes. (There is nothing left to do.)

5. Printing statistics.

=== td_fused_top_dataflow_in_loop_TOP_LOOP48462_accum1_out_0_memcore ===

   Number of wires:                 11
   Number of wire bits:             60
   Number of public wires:          11
   Number of public wire bits:      60
   Number of memories:               0
   Number of memory bits:            0
   Number of processes:              0
   Number of cells:                  1

=== td_fused_top_dataflow_in_loop_TOP_LOOP48462_accum1_out_0_memcore_ram ===

   Number of wires:                 23
   Number of wire bits:            215
   Number of public wires:          10
   Number of public wire bits:      59
   Number of memories:               1
   Number of memory bits:          128
   Number of processes:              0
   Number of cells:                 16
     $dffe                          16
     $mux                           80

=== design hierarchy ===

   td_fused_top_dataflow_in_loop_TOP_LOOP48462_accum1_out_0_memcore      1
     td_fused_top_dataflow_in_loop_TOP_LOOP48462_accum1_out_0_memcore_ram      0

   Number of wires:                 11
   Number of wire bits:             60
   Number of public wires:          11
   Number of public wire bits:      60
   Number of memories:               0
   Number of memory bits:            0
   Number of processes:              0
   Number of cells:                  1

End of script. Logfile hash: 4ac7fc3285, CPU: user 0.04s system 0.00s, MEM: 11.47 MB peak
Yosys 0.10+12 (git sha1 72fac04, gcc 7.4.0-1ubuntu1~16.04~ppa1 -fPIC -Os)
Time spent: 22% 2x opt_clean (0 sec), 11% 4x opt_expr (0 sec), ...
