
 /----------------------------------------------------------------------------\
 |                                                                            |
 |  yosys -- Yosys Open SYnthesis Suite                                       |
 |                                                                            |
 |  Copyright (C) 2012 - 2020  Claire Xenia Wolf <claire@yosyshq.com>         |
 |                                                                            |
 |  Permission to use, copy, modify, and/or distribute this software for any  |
 |  purpose with or without fee is hereby granted, provided that the above    |
 |  copyright notice and this permission notice appear in all copies.         |
 |                                                                            |
 |  THE SOFTWARE IS PROVIDED "AS IS" AND THE AUTHOR DISCLAIMS ALL WARRANTIES  |
 |  WITH REGARD TO THIS SOFTWARE INCLUDING ALL IMPLIED WARRANTIES OF          |
 |  MERCHANTABILITY AND FITNESS. IN NO EVENT SHALL THE AUTHOR BE LIABLE FOR   |
 |  ANY SPECIAL, DIRECT, INDIRECT, OR CONSEQUENTIAL DAMAGES OR ANY DAMAGES    |
 |  WHATSOEVER RESULTING FROM LOSS OF USE, DATA OR PROFITS, WHETHER IN AN     |
 |  ACTION OF CONTRACT, NEGLIGENCE OR OTHER TORTIOUS ACTION, ARISING OUT OF   |
 |  OR IN CONNECTION WITH THE USE OR PERFORMANCE OF THIS SOFTWARE.            |
 |                                                                            |
 \----------------------------------------------------------------------------/

 Yosys 0.10+12 (git sha1 72fac04, gcc 7.4.0-1ubuntu1~16.04~ppa1 -fPIC -Os)


-- Executing script file `out.ys' --

1. Executing Verilog-2005 frontend: /home/zhigang/raw_data/raw_designs/vtr_designs/verilog/koios/conv_layer_hls_submodules/td_fused_top_dataflow_in_loop_TOP_LOOP49028_accum1_out_0_memcore.v
Parsing SystemVerilog input from `/home/zhigang/raw_data/raw_designs/vtr_designs/verilog/koios/conv_layer_hls_submodules/td_fused_top_dataflow_in_loop_TOP_LOOP49028_accum1_out_0_memcore.v' to AST representation.
Generating RTLIL representation for module `\td_fused_top_dataflow_in_loop_TOP_LOOP49028_accum1_out_0_memcore'.
Generating RTLIL representation for module `\dpram'.
Successfully finished Verilog frontend.

2. Executing HIERARCHY pass (managing design hierarchy).

2.1. Finding top of design hierarchy..
root of   0 design levels: dpram               
root of   1 design levels: td_fused_top_dataflow_in_loop_TOP_LOOP49028_accum1_out_0_memcore
Automatically selected td_fused_top_dataflow_in_loop_TOP_LOOP49028_accum1_out_0_memcore as design top module.

2.2. Analyzing design hierarchy..
Top module:  \td_fused_top_dataflow_in_loop_TOP_LOOP49028_accum1_out_0_memcore
Used module:     \dpram
Parameter \AWIDTH = 3
Parameter \NUM_WORDS = 8
Parameter \DWIDTH = 16

2.3. Executing AST frontend in derive mode using pre-parsed AST for module `\dpram'.
Parameter \AWIDTH = 3
Parameter \NUM_WORDS = 8
Parameter \DWIDTH = 16
Generating RTLIL representation for module `$paramod$06d1378780a49be520a2b3a2c4922119883641e2\dpram'.

2.4. Analyzing design hierarchy..
Top module:  \td_fused_top_dataflow_in_loop_TOP_LOOP49028_accum1_out_0_memcore
Used module:     $paramod$06d1378780a49be520a2b3a2c4922119883641e2\dpram

2.5. Analyzing design hierarchy..
Top module:  \td_fused_top_dataflow_in_loop_TOP_LOOP49028_accum1_out_0_memcore
Used module:     $paramod$06d1378780a49be520a2b3a2c4922119883641e2\dpram
Removing unused module `\dpram'.
Removed 1 unused modules.

3. Executing PROC pass (convert processes to netlists).

3.1. Executing PROC_CLEAN pass (remove empty switches from decision trees).
Cleaned up 0 empty switches.

3.2. Executing PROC_RMDEAD pass (remove dead branches from decision trees).
Marked 1 switch rules as full_case in process $proc$/home/zhigang/raw_data/raw_designs/vtr_designs/verilog/koios/conv_layer_hls_submodules/td_fused_top_dataflow_in_loop_TOP_LOOP49028_accum1_out_0_memcore.v:151$31 in module $paramod$06d1378780a49be520a2b3a2c4922119883641e2\dpram.
Marked 1 switch rules as full_case in process $proc$/home/zhigang/raw_data/raw_designs/vtr_designs/verilog/koios/conv_layer_hls_submodules/td_fused_top_dataflow_in_loop_TOP_LOOP49028_accum1_out_0_memcore.v:133$23 in module $paramod$06d1378780a49be520a2b3a2c4922119883641e2\dpram.
Removed a total of 0 dead cases.

3.3. Executing PROC_PRUNE pass (remove redundant assignments in processes).
Removed 0 redundant assignments.
Promoted 6 assignments to connections.

3.4. Executing PROC_INIT pass (extract init attributes).

3.5. Executing PROC_ARST pass (detect async resets in processes).

3.6. Executing PROC_MUX pass (convert decision trees to multiplexers).
Creating decoders for process `$paramod$06d1378780a49be520a2b3a2c4922119883641e2\dpram.$proc$/home/zhigang/raw_data/raw_designs/vtr_designs/verilog/koios/conv_layer_hls_submodules/td_fused_top_dataflow_in_loop_TOP_LOOP49028_accum1_out_0_memcore.v:151$31'.
     1/4: $1$memwr$\ram$/home/zhigang/raw_data/raw_designs/vtr_designs/verilog/koios/conv_layer_hls_submodules/td_fused_top_dataflow_in_loop_TOP_LOOP49028_accum1_out_0_memcore.v:155$22_EN[15:0]$37
     2/4: $1$memwr$\ram$/home/zhigang/raw_data/raw_designs/vtr_designs/verilog/koios/conv_layer_hls_submodules/td_fused_top_dataflow_in_loop_TOP_LOOP49028_accum1_out_0_memcore.v:155$22_DATA[15:0]$36
     3/4: $1$memwr$\ram$/home/zhigang/raw_data/raw_designs/vtr_designs/verilog/koios/conv_layer_hls_submodules/td_fused_top_dataflow_in_loop_TOP_LOOP49028_accum1_out_0_memcore.v:155$22_ADDR[2:0]$35
     4/4: $0\out_b[15:0]
Creating decoders for process `$paramod$06d1378780a49be520a2b3a2c4922119883641e2\dpram.$proc$/home/zhigang/raw_data/raw_designs/vtr_designs/verilog/koios/conv_layer_hls_submodules/td_fused_top_dataflow_in_loop_TOP_LOOP49028_accum1_out_0_memcore.v:133$23'.
     1/4: $1$memwr$\ram$/home/zhigang/raw_data/raw_designs/vtr_designs/verilog/koios/conv_layer_hls_submodules/td_fused_top_dataflow_in_loop_TOP_LOOP49028_accum1_out_0_memcore.v:137$21_EN[15:0]$29
     2/4: $1$memwr$\ram$/home/zhigang/raw_data/raw_designs/vtr_designs/verilog/koios/conv_layer_hls_submodules/td_fused_top_dataflow_in_loop_TOP_LOOP49028_accum1_out_0_memcore.v:137$21_DATA[15:0]$28
     3/4: $1$memwr$\ram$/home/zhigang/raw_data/raw_designs/vtr_designs/verilog/koios/conv_layer_hls_submodules/td_fused_top_dataflow_in_loop_TOP_LOOP49028_accum1_out_0_memcore.v:137$21_ADDR[2:0]$27
     4/4: $0\out_a[15:0]

3.7. Executing PROC_DLATCH pass (convert process syncs to latches).

3.8. Executing PROC_DFF pass (convert process syncs to FFs).
Creating register for signal `$paramod$06d1378780a49be520a2b3a2c4922119883641e2\dpram.\out_b' using process `$paramod$06d1378780a49be520a2b3a2c4922119883641e2\dpram.$proc$/home/zhigang/raw_data/raw_designs/vtr_designs/verilog/koios/conv_layer_hls_submodules/td_fused_top_dataflow_in_loop_TOP_LOOP49028_accum1_out_0_memcore.v:151$31'.
  created $dff cell `$procdff$63' with positive edge clock.
Creating register for signal `$paramod$06d1378780a49be520a2b3a2c4922119883641e2\dpram.$memwr$\ram$/home/zhigang/raw_data/raw_designs/vtr_designs/verilog/koios/conv_layer_hls_submodules/td_fused_top_dataflow_in_loop_TOP_LOOP49028_accum1_out_0_memcore.v:155$22_ADDR' using process `$paramod$06d1378780a49be520a2b3a2c4922119883641e2\dpram.$proc$/home/zhigang/raw_data/raw_designs/vtr_designs/verilog/koios/conv_layer_hls_submodules/td_fused_top_dataflow_in_loop_TOP_LOOP49028_accum1_out_0_memcore.v:151$31'.
  created $dff cell `$procdff$64' with positive edge clock.
Creating register for signal `$paramod$06d1378780a49be520a2b3a2c4922119883641e2\dpram.$memwr$\ram$/home/zhigang/raw_data/raw_designs/vtr_designs/verilog/koios/conv_layer_hls_submodules/td_fused_top_dataflow_in_loop_TOP_LOOP49028_accum1_out_0_memcore.v:155$22_DATA' using process `$paramod$06d1378780a49be520a2b3a2c4922119883641e2\dpram.$proc$/home/zhigang/raw_data/raw_designs/vtr_designs/verilog/koios/conv_layer_hls_submodules/td_fused_top_dataflow_in_loop_TOP_LOOP49028_accum1_out_0_memcore.v:151$31'.
  created $dff cell `$procdff$65' with positive edge clock.
Creating register for signal `$paramod$06d1378780a49be520a2b3a2c4922119883641e2\dpram.$memwr$\ram$/home/zhigang/raw_data/raw_designs/vtr_designs/verilog/koios/conv_layer_hls_submodules/td_fused_top_dataflow_in_loop_TOP_LOOP49028_accum1_out_0_memcore.v:155$22_EN' using process `$paramod$06d1378780a49be520a2b3a2c4922119883641e2\dpram.$proc$/home/zhigang/raw_data/raw_designs/vtr_designs/verilog/koios/conv_layer_hls_submodules/td_fused_top_dataflow_in_loop_TOP_LOOP49028_accum1_out_0_memcore.v:151$31'.
  created $dff cell `$procdff$66' with positive edge clock.
Creating register for signal `$paramod$06d1378780a49be520a2b3a2c4922119883641e2\dpram.\out_a' using process `$paramod$06d1378780a49be520a2b3a2c4922119883641e2\dpram.$proc$/home/zhigang/raw_data/raw_designs/vtr_designs/verilog/koios/conv_layer_hls_submodules/td_fused_top_dataflow_in_loop_TOP_LOOP49028_accum1_out_0_memcore.v:133$23'.
  created $dff cell `$procdff$67' with positive edge clock.
Creating register for signal `$paramod$06d1378780a49be520a2b3a2c4922119883641e2\dpram.$memwr$\ram$/home/zhigang/raw_data/raw_designs/vtr_designs/verilog/koios/conv_layer_hls_submodules/td_fused_top_dataflow_in_loop_TOP_LOOP49028_accum1_out_0_memcore.v:137$21_ADDR' using process `$paramod$06d1378780a49be520a2b3a2c4922119883641e2\dpram.$proc$/home/zhigang/raw_data/raw_designs/vtr_designs/verilog/koios/conv_layer_hls_submodules/td_fused_top_dataflow_in_loop_TOP_LOOP49028_accum1_out_0_memcore.v:133$23'.
  created $dff cell `$procdff$68' with positive edge clock.
Creating register for signal `$paramod$06d1378780a49be520a2b3a2c4922119883641e2\dpram.$memwr$\ram$/home/zhigang/raw_data/raw_designs/vtr_designs/verilog/koios/conv_layer_hls_submodules/td_fused_top_dataflow_in_loop_TOP_LOOP49028_accum1_out_0_memcore.v:137$21_DATA' using process `$paramod$06d1378780a49be520a2b3a2c4922119883641e2\dpram.$proc$/home/zhigang/raw_data/raw_designs/vtr_designs/verilog/koios/conv_layer_hls_submodules/td_fused_top_dataflow_in_loop_TOP_LOOP49028_accum1_out_0_memcore.v:133$23'.
  created $dff cell `$procdff$69' with positive edge clock.
Creating register for signal `$paramod$06d1378780a49be520a2b3a2c4922119883641e2\dpram.$memwr$\ram$/home/zhigang/raw_data/raw_designs/vtr_designs/verilog/koios/conv_layer_hls_submodules/td_fused_top_dataflow_in_loop_TOP_LOOP49028_accum1_out_0_memcore.v:137$21_EN' using process `$paramod$06d1378780a49be520a2b3a2c4922119883641e2\dpram.$proc$/home/zhigang/raw_data/raw_designs/vtr_designs/verilog/koios/conv_layer_hls_submodules/td_fused_top_dataflow_in_loop_TOP_LOOP49028_accum1_out_0_memcore.v:133$23'.
  created $dff cell `$procdff$70' with positive edge clock.

3.9. Executing PROC_MEMWR pass (convert process memory writes to cells).

3.10. Executing PROC_CLEAN pass (remove empty switches from decision trees).
Found and cleaned up 1 empty switch in `$paramod$06d1378780a49be520a2b3a2c4922119883641e2\dpram.$proc$/home/zhigang/raw_data/raw_designs/vtr_designs/verilog/koios/conv_layer_hls_submodules/td_fused_top_dataflow_in_loop_TOP_LOOP49028_accum1_out_0_memcore.v:151$31'.
Removing empty process `$paramod$06d1378780a49be520a2b3a2c4922119883641e2\dpram.$proc$/home/zhigang/raw_data/raw_designs/vtr_designs/verilog/koios/conv_layer_hls_submodules/td_fused_top_dataflow_in_loop_TOP_LOOP49028_accum1_out_0_memcore.v:151$31'.
Found and cleaned up 1 empty switch in `$paramod$06d1378780a49be520a2b3a2c4922119883641e2\dpram.$proc$/home/zhigang/raw_data/raw_designs/vtr_designs/verilog/koios/conv_layer_hls_submodules/td_fused_top_dataflow_in_loop_TOP_LOOP49028_accum1_out_0_memcore.v:133$23'.
Removing empty process `$paramod$06d1378780a49be520a2b3a2c4922119883641e2\dpram.$proc$/home/zhigang/raw_data/raw_designs/vtr_designs/verilog/koios/conv_layer_hls_submodules/td_fused_top_dataflow_in_loop_TOP_LOOP49028_accum1_out_0_memcore.v:133$23'.
Cleaned up 2 empty switches.

3.11. Executing OPT_EXPR pass (perform const folding).
Optimizing module $paramod$06d1378780a49be520a2b3a2c4922119883641e2\dpram.
Optimizing module td_fused_top_dataflow_in_loop_TOP_LOOP49028_accum1_out_0_memcore.

4. Executing OPT pass (performing simple optimizations).

4.1. Executing OPT_EXPR pass (perform const folding).
Optimizing module $paramod$06d1378780a49be520a2b3a2c4922119883641e2\dpram.
Optimizing module td_fused_top_dataflow_in_loop_TOP_LOOP49028_accum1_out_0_memcore.

4.2. Executing OPT_MERGE pass (detect identical cells).
Finding identical cells in module `$paramod$06d1378780a49be520a2b3a2c4922119883641e2\dpram'.
Finding identical cells in module `\td_fused_top_dataflow_in_loop_TOP_LOOP49028_accum1_out_0_memcore'.
Removed a total of 0 cells.

4.3. Executing OPT_MUXTREE pass (detect dead branches in mux trees).
Running muxtree optimizer on module $paramod$06d1378780a49be520a2b3a2c4922119883641e2\dpram..
  Creating internal representation of mux trees.
  Evaluating internal representation of mux trees.
  Analyzing evaluation results.
Running muxtree optimizer on module \td_fused_top_dataflow_in_loop_TOP_LOOP49028_accum1_out_0_memcore..
  Creating internal representation of mux trees.
  No muxes found in this module.
Removed 0 multiplexer ports.
<suppressed ~8 debug messages>

4.4. Executing OPT_REDUCE pass (consolidate $*mux and $reduce_* inputs).
  Optimizing cells in module $paramod$06d1378780a49be520a2b3a2c4922119883641e2\dpram.
    Consolidated identical input bits for $mux cell $procmux$52:
      Old ports: A=16'0000000000000000, B=16'1111111111111111, Y=$procmux$52_Y
      New ports: A=1'0, B=1'1, Y=$procmux$52_Y [0]
      New connections: $procmux$52_Y [15:1] = { $procmux$52_Y [0] $procmux$52_Y [0] $procmux$52_Y [0] $procmux$52_Y [0] $procmux$52_Y [0] $procmux$52_Y [0] $procmux$52_Y [0] $procmux$52_Y [0] $procmux$52_Y [0] $procmux$52_Y [0] $procmux$52_Y [0] $procmux$52_Y [0] $procmux$52_Y [0] $procmux$52_Y [0] $procmux$52_Y [0] }
    Consolidated identical input bits for $mux cell $procmux$40:
      Old ports: A=16'0000000000000000, B=16'1111111111111111, Y=$procmux$40_Y
      New ports: A=1'0, B=1'1, Y=$procmux$40_Y [0]
      New connections: $procmux$40_Y [15:1] = { $procmux$40_Y [0] $procmux$40_Y [0] $procmux$40_Y [0] $procmux$40_Y [0] $procmux$40_Y [0] $procmux$40_Y [0] $procmux$40_Y [0] $procmux$40_Y [0] $procmux$40_Y [0] $procmux$40_Y [0] $procmux$40_Y [0] $procmux$40_Y [0] $procmux$40_Y [0] $procmux$40_Y [0] $procmux$40_Y [0] }
  Optimizing cells in module $paramod$06d1378780a49be520a2b3a2c4922119883641e2\dpram.
  Optimizing cells in module \td_fused_top_dataflow_in_loop_TOP_LOOP49028_accum1_out_0_memcore.
Performed a total of 2 changes.

4.5. Executing OPT_MERGE pass (detect identical cells).
Finding identical cells in module `$paramod$06d1378780a49be520a2b3a2c4922119883641e2\dpram'.
Finding identical cells in module `\td_fused_top_dataflow_in_loop_TOP_LOOP49028_accum1_out_0_memcore'.
Removed a total of 0 cells.

4.6. Executing OPT_DFF pass (perform DFF optimizations).
Adding EN signal on $procdff$63 ($dff) from module $paramod$06d1378780a49be520a2b3a2c4922119883641e2\dpram (D = $memrd$\ram$/home/zhigang/raw_data/raw_designs/vtr_designs/verilog/koios/conv_layer_hls_submodules/td_fused_top_dataflow_in_loop_TOP_LOOP49028_accum1_out_0_memcore.v:161$38_DATA, Q = \out_b).
Adding EN signal on $procdff$67 ($dff) from module $paramod$06d1378780a49be520a2b3a2c4922119883641e2\dpram (D = $memrd$\ram$/home/zhigang/raw_data/raw_designs/vtr_designs/verilog/koios/conv_layer_hls_submodules/td_fused_top_dataflow_in_loop_TOP_LOOP49028_accum1_out_0_memcore.v:143$30_DATA, Q = \out_a).

4.7. Executing OPT_CLEAN pass (remove unused cells and wires).
Finding unused cells or wires in module $paramod$06d1378780a49be520a2b3a2c4922119883641e2\dpram..
Finding unused cells or wires in module \td_fused_top_dataflow_in_loop_TOP_LOOP49028_accum1_out_0_memcore..
Removed 8 unused cells and 32 unused wires.
<suppressed ~10 debug messages>

4.8. Executing OPT_EXPR pass (perform const folding).
Optimizing module $paramod$06d1378780a49be520a2b3a2c4922119883641e2\dpram.
Optimizing module td_fused_top_dataflow_in_loop_TOP_LOOP49028_accum1_out_0_memcore.

4.9. Rerunning OPT passes. (Maybe there is more to do..)

4.10. Executing OPT_MUXTREE pass (detect dead branches in mux trees).
Running muxtree optimizer on module $paramod$06d1378780a49be520a2b3a2c4922119883641e2\dpram..
  Creating internal representation of mux trees.
  Evaluating internal representation of mux trees.
  Analyzing evaluation results.
Running muxtree optimizer on module \td_fused_top_dataflow_in_loop_TOP_LOOP49028_accum1_out_0_memcore..
  Creating internal representation of mux trees.
  No muxes found in this module.
Removed 0 multiplexer ports.
<suppressed ~6 debug messages>

4.11. Executing OPT_REDUCE pass (consolidate $*mux and $reduce_* inputs).
  Optimizing cells in module $paramod$06d1378780a49be520a2b3a2c4922119883641e2\dpram.
  Optimizing cells in module \td_fused_top_dataflow_in_loop_TOP_LOOP49028_accum1_out_0_memcore.
Performed a total of 0 changes.

4.12. Executing OPT_MERGE pass (detect identical cells).
Finding identical cells in module `$paramod$06d1378780a49be520a2b3a2c4922119883641e2\dpram'.
Finding identical cells in module `\td_fused_top_dataflow_in_loop_TOP_LOOP49028_accum1_out_0_memcore'.
Removed a total of 0 cells.

4.13. Executing OPT_DFF pass (perform DFF optimizations).

4.14. Executing OPT_CLEAN pass (remove unused cells and wires).
Finding unused cells or wires in module $paramod$06d1378780a49be520a2b3a2c4922119883641e2\dpram..
Finding unused cells or wires in module \td_fused_top_dataflow_in_loop_TOP_LOOP49028_accum1_out_0_memcore..

4.15. Executing OPT_EXPR pass (perform const folding).
Optimizing module $paramod$06d1378780a49be520a2b3a2c4922119883641e2\dpram.
Optimizing module td_fused_top_dataflow_in_loop_TOP_LOOP49028_accum1_out_0_memcore.

4.16. Finished OPT passes. (There is nothing left to do.)

5. Printing statistics.

=== $paramod$06d1378780a49be520a2b3a2c4922119883641e2\dpram ===

   Number of wires:                 17
   Number of wire bits:            175
   Number of public wires:           9
   Number of public wire bits:      73
   Number of memories:               1
   Number of memory bits:          128
   Number of processes:              0
   Number of cells:                 12
     $dffe                          32
     $mux                           40

=== td_fused_top_dataflow_in_loop_TOP_LOOP49028_accum1_out_0_memcore ===

   Number of wires:                 14
   Number of wire bits:             78
   Number of public wires:          14
   Number of public wire bits:      78
   Number of memories:               0
   Number of memory bits:            0
   Number of processes:              0
   Number of cells:                  3
     $and                            2

=== design hierarchy ===

   td_fused_top_dataflow_in_loop_TOP_LOOP49028_accum1_out_0_memcore      1
     $paramod$06d1378780a49be520a2b3a2c4922119883641e2\dpram      0

   Number of wires:                 14
   Number of wire bits:             78
   Number of public wires:          14
   Number of public wire bits:      78
   Number of memories:               0
   Number of memory bits:            0
   Number of processes:              0
   Number of cells:                  3
     $and                            2

End of script. Logfile hash: 359ac5cd32, CPU: user 0.03s system 0.01s, MEM: 11.53 MB peak
Yosys 0.10+12 (git sha1 72fac04, gcc 7.4.0-1ubuntu1~16.04~ppa1 -fPIC -Os)
Time spent: 22% 2x opt_clean (0 sec), 11% 4x opt_expr (0 sec), ...
