
 /----------------------------------------------------------------------------\
 |                                                                            |
 |  yosys -- Yosys Open SYnthesis Suite                                       |
 |                                                                            |
 |  Copyright (C) 2012 - 2020  Claire Xenia Wolf <claire@yosyshq.com>         |
 |                                                                            |
 |  Permission to use, copy, modify, and/or distribute this software for any  |
 |  purpose with or without fee is hereby granted, provided that the above    |
 |  copyright notice and this permission notice appear in all copies.         |
 |                                                                            |
 |  THE SOFTWARE IS PROVIDED "AS IS" AND THE AUTHOR DISCLAIMS ALL WARRANTIES  |
 |  WITH REGARD TO THIS SOFTWARE INCLUDING ALL IMPLIED WARRANTIES OF          |
 |  MERCHANTABILITY AND FITNESS. IN NO EVENT SHALL THE AUTHOR BE LIABLE FOR   |
 |  ANY SPECIAL, DIRECT, INDIRECT, OR CONSEQUENTIAL DAMAGES OR ANY DAMAGES    |
 |  WHATSOEVER RESULTING FROM LOSS OF USE, DATA OR PROFITS, WHETHER IN AN     |
 |  ACTION OF CONTRACT, NEGLIGENCE OR OTHER TORTIOUS ACTION, ARISING OUT OF   |
 |  OR IN CONNECTION WITH THE USE OR PERFORMANCE OF THIS SOFTWARE.            |
 |                                                                            |
 \----------------------------------------------------------------------------/

 Yosys 0.10+12 (git sha1 72fac04, gcc 7.4.0-1ubuntu1~16.04~ppa1 -fPIC -Os)


-- Executing script file `out.ys' --

1. Executing Verilog-2005 frontend: /home/zhigang/raw_data/raw_designs/vtr_designs/verilog/koios/tiny_darknet_like.small_submodules/td_fused_top_tdf11_l2_writeOutputs_171_running_sums_2.v
Parsing SystemVerilog input from `/home/zhigang/raw_data/raw_designs/vtr_designs/verilog/koios/tiny_darknet_like.small_submodules/td_fused_top_tdf11_l2_writeOutputs_171_running_sums_2.v' to AST representation.
Generating RTLIL representation for module `\td_fused_top_tdf11_l2_writeOutputs_171_running_sums_2'.
Generating RTLIL representation for module `\td_fused_top_tdf11_l2_writeOutputs_171_running_sums_2_ram'.
Successfully finished Verilog frontend.

2. Executing HIERARCHY pass (managing design hierarchy).

2.1. Finding top of design hierarchy..
root of   0 design levels: td_fused_top_tdf11_l2_writeOutputs_171_running_sums_2_ram
root of   1 design levels: td_fused_top_tdf11_l2_writeOutputs_171_running_sums_2
Automatically selected td_fused_top_tdf11_l2_writeOutputs_171_running_sums_2 as design top module.

2.2. Analyzing design hierarchy..
Top module:  \td_fused_top_tdf11_l2_writeOutputs_171_running_sums_2
Used module:     \td_fused_top_tdf11_l2_writeOutputs_171_running_sums_2_ram

2.3. Analyzing design hierarchy..
Top module:  \td_fused_top_tdf11_l2_writeOutputs_171_running_sums_2
Used module:     \td_fused_top_tdf11_l2_writeOutputs_171_running_sums_2_ram
Removed 0 unused modules.

3. Executing PROC pass (convert processes to netlists).

3.1. Executing PROC_CLEAN pass (remove empty switches from decision trees).
Cleaned up 0 empty switches.

3.2. Executing PROC_RMDEAD pass (remove dead branches from decision trees).
Marked 2 switch rules as full_case in process $proc$/home/zhigang/raw_data/raw_designs/vtr_designs/verilog/koios/tiny_darknet_like.small_submodules/td_fused_top_tdf11_l2_writeOutputs_171_running_sums_2.v:76$2 in module td_fused_top_tdf11_l2_writeOutputs_171_running_sums_2_ram.
Removed a total of 0 dead cases.

3.3. Executing PROC_PRUNE pass (remove redundant assignments in processes).
Removed 0 redundant assignments.
Promoted 3 assignments to connections.

3.4. Executing PROC_INIT pass (extract init attributes).

3.5. Executing PROC_ARST pass (detect async resets in processes).

3.6. Executing PROC_MUX pass (convert decision trees to multiplexers).
Creating decoders for process `\td_fused_top_tdf11_l2_writeOutputs_171_running_sums_2_ram.$proc$/home/zhigang/raw_data/raw_designs/vtr_designs/verilog/koios/tiny_darknet_like.small_submodules/td_fused_top_tdf11_l2_writeOutputs_171_running_sums_2.v:85$12'.
     1/1: $0\q1[15:0]
Creating decoders for process `\td_fused_top_tdf11_l2_writeOutputs_171_running_sums_2_ram.$proc$/home/zhigang/raw_data/raw_designs/vtr_designs/verilog/koios/tiny_darknet_like.small_submodules/td_fused_top_tdf11_l2_writeOutputs_171_running_sums_2.v:76$2'.
     1/6: $2$memwr$\ram$/home/zhigang/raw_data/raw_designs/vtr_designs/verilog/koios/tiny_darknet_like.small_submodules/td_fused_top_tdf11_l2_writeOutputs_171_running_sums_2.v:80$1_EN[15:0]$11
     2/6: $2$memwr$\ram$/home/zhigang/raw_data/raw_designs/vtr_designs/verilog/koios/tiny_darknet_like.small_submodules/td_fused_top_tdf11_l2_writeOutputs_171_running_sums_2.v:80$1_DATA[15:0]$10
     3/6: $2$memwr$\ram$/home/zhigang/raw_data/raw_designs/vtr_designs/verilog/koios/tiny_darknet_like.small_submodules/td_fused_top_tdf11_l2_writeOutputs_171_running_sums_2.v:80$1_ADDR[6:0]$9
     4/6: $1$memwr$\ram$/home/zhigang/raw_data/raw_designs/vtr_designs/verilog/koios/tiny_darknet_like.small_submodules/td_fused_top_tdf11_l2_writeOutputs_171_running_sums_2.v:80$1_EN[15:0]$8
     5/6: $1$memwr$\ram$/home/zhigang/raw_data/raw_designs/vtr_designs/verilog/koios/tiny_darknet_like.small_submodules/td_fused_top_tdf11_l2_writeOutputs_171_running_sums_2.v:80$1_DATA[15:0]$7
     6/6: $1$memwr$\ram$/home/zhigang/raw_data/raw_designs/vtr_designs/verilog/koios/tiny_darknet_like.small_submodules/td_fused_top_tdf11_l2_writeOutputs_171_running_sums_2.v:80$1_ADDR[6:0]$6

3.7. Executing PROC_DLATCH pass (convert process syncs to latches).

3.8. Executing PROC_DFF pass (convert process syncs to FFs).
Creating register for signal `\td_fused_top_tdf11_l2_writeOutputs_171_running_sums_2_ram.\q1' using process `\td_fused_top_tdf11_l2_writeOutputs_171_running_sums_2_ram.$proc$/home/zhigang/raw_data/raw_designs/vtr_designs/verilog/koios/tiny_darknet_like.small_submodules/td_fused_top_tdf11_l2_writeOutputs_171_running_sums_2.v:85$12'.
  created $dff cell `$procdff$43' with positive edge clock.
Creating register for signal `\td_fused_top_tdf11_l2_writeOutputs_171_running_sums_2_ram.$memwr$\ram$/home/zhigang/raw_data/raw_designs/vtr_designs/verilog/koios/tiny_darknet_like.small_submodules/td_fused_top_tdf11_l2_writeOutputs_171_running_sums_2.v:80$1_ADDR' using process `\td_fused_top_tdf11_l2_writeOutputs_171_running_sums_2_ram.$proc$/home/zhigang/raw_data/raw_designs/vtr_designs/verilog/koios/tiny_darknet_like.small_submodules/td_fused_top_tdf11_l2_writeOutputs_171_running_sums_2.v:76$2'.
  created $dff cell `$procdff$44' with positive edge clock.
Creating register for signal `\td_fused_top_tdf11_l2_writeOutputs_171_running_sums_2_ram.$memwr$\ram$/home/zhigang/raw_data/raw_designs/vtr_designs/verilog/koios/tiny_darknet_like.small_submodules/td_fused_top_tdf11_l2_writeOutputs_171_running_sums_2.v:80$1_DATA' using process `\td_fused_top_tdf11_l2_writeOutputs_171_running_sums_2_ram.$proc$/home/zhigang/raw_data/raw_designs/vtr_designs/verilog/koios/tiny_darknet_like.small_submodules/td_fused_top_tdf11_l2_writeOutputs_171_running_sums_2.v:76$2'.
  created $dff cell `$procdff$45' with positive edge clock.
Creating register for signal `\td_fused_top_tdf11_l2_writeOutputs_171_running_sums_2_ram.$memwr$\ram$/home/zhigang/raw_data/raw_designs/vtr_designs/verilog/koios/tiny_darknet_like.small_submodules/td_fused_top_tdf11_l2_writeOutputs_171_running_sums_2.v:80$1_EN' using process `\td_fused_top_tdf11_l2_writeOutputs_171_running_sums_2_ram.$proc$/home/zhigang/raw_data/raw_designs/vtr_designs/verilog/koios/tiny_darknet_like.small_submodules/td_fused_top_tdf11_l2_writeOutputs_171_running_sums_2.v:76$2'.
  created $dff cell `$procdff$46' with positive edge clock.

3.9. Executing PROC_MEMWR pass (convert process memory writes to cells).

3.10. Executing PROC_CLEAN pass (remove empty switches from decision trees).
Found and cleaned up 1 empty switch in `\td_fused_top_tdf11_l2_writeOutputs_171_running_sums_2_ram.$proc$/home/zhigang/raw_data/raw_designs/vtr_designs/verilog/koios/tiny_darknet_like.small_submodules/td_fused_top_tdf11_l2_writeOutputs_171_running_sums_2.v:85$12'.
Removing empty process `td_fused_top_tdf11_l2_writeOutputs_171_running_sums_2_ram.$proc$/home/zhigang/raw_data/raw_designs/vtr_designs/verilog/koios/tiny_darknet_like.small_submodules/td_fused_top_tdf11_l2_writeOutputs_171_running_sums_2.v:85$12'.
Found and cleaned up 2 empty switches in `\td_fused_top_tdf11_l2_writeOutputs_171_running_sums_2_ram.$proc$/home/zhigang/raw_data/raw_designs/vtr_designs/verilog/koios/tiny_darknet_like.small_submodules/td_fused_top_tdf11_l2_writeOutputs_171_running_sums_2.v:76$2'.
Removing empty process `td_fused_top_tdf11_l2_writeOutputs_171_running_sums_2_ram.$proc$/home/zhigang/raw_data/raw_designs/vtr_designs/verilog/koios/tiny_darknet_like.small_submodules/td_fused_top_tdf11_l2_writeOutputs_171_running_sums_2.v:76$2'.
Cleaned up 3 empty switches.

3.11. Executing OPT_EXPR pass (perform const folding).
Optimizing module td_fused_top_tdf11_l2_writeOutputs_171_running_sums_2_ram.
Optimizing module td_fused_top_tdf11_l2_writeOutputs_171_running_sums_2.

4. Executing OPT pass (performing simple optimizations).

4.1. Executing OPT_EXPR pass (perform const folding).
Optimizing module td_fused_top_tdf11_l2_writeOutputs_171_running_sums_2_ram.
Optimizing module td_fused_top_tdf11_l2_writeOutputs_171_running_sums_2.

4.2. Executing OPT_MERGE pass (detect identical cells).
Finding identical cells in module `\td_fused_top_tdf11_l2_writeOutputs_171_running_sums_2_ram'.
Finding identical cells in module `\td_fused_top_tdf11_l2_writeOutputs_171_running_sums_2'.
Removed a total of 0 cells.

4.3. Executing OPT_MUXTREE pass (detect dead branches in mux trees).
Running muxtree optimizer on module \td_fused_top_tdf11_l2_writeOutputs_171_running_sums_2_ram..
  Creating internal representation of mux trees.
  Evaluating internal representation of mux trees.
  Analyzing evaluation results.
    dead port 2/2 on $mux $procmux$32.
    dead port 2/2 on $mux $procmux$26.
    dead port 2/2 on $mux $procmux$20.
Running muxtree optimizer on module \td_fused_top_tdf11_l2_writeOutputs_171_running_sums_2..
  Creating internal representation of mux trees.
  No muxes found in this module.
Removed 3 multiplexer ports.
<suppressed ~4 debug messages>

4.4. Executing OPT_REDUCE pass (consolidate $*mux and $reduce_* inputs).
  Optimizing cells in module \td_fused_top_tdf11_l2_writeOutputs_171_running_sums_2_ram.
    Consolidated identical input bits for $mux cell $procmux$18:
      Old ports: A=16'0000000000000000, B=16'1111111111111111, Y=$procmux$18_Y
      New ports: A=1'0, B=1'1, Y=$procmux$18_Y [0]
      New connections: $procmux$18_Y [15:1] = { $procmux$18_Y [0] $procmux$18_Y [0] $procmux$18_Y [0] $procmux$18_Y [0] $procmux$18_Y [0] $procmux$18_Y [0] $procmux$18_Y [0] $procmux$18_Y [0] $procmux$18_Y [0] $procmux$18_Y [0] $procmux$18_Y [0] $procmux$18_Y [0] $procmux$18_Y [0] $procmux$18_Y [0] $procmux$18_Y [0] }
  Optimizing cells in module \td_fused_top_tdf11_l2_writeOutputs_171_running_sums_2_ram.
    Consolidated identical input bits for $mux cell $procmux$35:
      Old ports: A=16'0000000000000000, B=$procmux$18_Y, Y=$procmux$35_Y
      New ports: A=1'0, B=$procmux$18_Y [0], Y=$procmux$35_Y [0]
      New connections: $procmux$35_Y [15:1] = { $procmux$35_Y [0] $procmux$35_Y [0] $procmux$35_Y [0] $procmux$35_Y [0] $procmux$35_Y [0] $procmux$35_Y [0] $procmux$35_Y [0] $procmux$35_Y [0] $procmux$35_Y [0] $procmux$35_Y [0] $procmux$35_Y [0] $procmux$35_Y [0] $procmux$35_Y [0] $procmux$35_Y [0] $procmux$35_Y [0] }
  Optimizing cells in module \td_fused_top_tdf11_l2_writeOutputs_171_running_sums_2_ram.
  Optimizing cells in module \td_fused_top_tdf11_l2_writeOutputs_171_running_sums_2.
Performed a total of 2 changes.

4.5. Executing OPT_MERGE pass (detect identical cells).
Finding identical cells in module `\td_fused_top_tdf11_l2_writeOutputs_171_running_sums_2_ram'.
Finding identical cells in module `\td_fused_top_tdf11_l2_writeOutputs_171_running_sums_2'.
Removed a total of 0 cells.

4.6. Executing OPT_DFF pass (perform DFF optimizations).
Adding EN signal on $procdff$43 ($dff) from module td_fused_top_tdf11_l2_writeOutputs_171_running_sums_2_ram (D = $memrd$\ram$/home/zhigang/raw_data/raw_designs/vtr_designs/verilog/koios/tiny_darknet_like.small_submodules/td_fused_top_tdf11_l2_writeOutputs_171_running_sums_2.v:88$13_DATA, Q = \q1).

4.7. Executing OPT_CLEAN pass (remove unused cells and wires).
Finding unused cells or wires in module \td_fused_top_tdf11_l2_writeOutputs_171_running_sums_2_ram..
Finding unused cells or wires in module \td_fused_top_tdf11_l2_writeOutputs_171_running_sums_2..
Removed 4 unused cells and 27 unused wires.
<suppressed ~5 debug messages>

4.8. Executing OPT_EXPR pass (perform const folding).
Optimizing module td_fused_top_tdf11_l2_writeOutputs_171_running_sums_2.
Optimizing module td_fused_top_tdf11_l2_writeOutputs_171_running_sums_2_ram.

4.9. Rerunning OPT passes. (Maybe there is more to do..)

4.10. Executing OPT_MUXTREE pass (detect dead branches in mux trees).
Running muxtree optimizer on module \td_fused_top_tdf11_l2_writeOutputs_171_running_sums_2..
  Creating internal representation of mux trees.
  No muxes found in this module.
Running muxtree optimizer on module \td_fused_top_tdf11_l2_writeOutputs_171_running_sums_2_ram..
  Creating internal representation of mux trees.
  Evaluating internal representation of mux trees.
  Analyzing evaluation results.
Removed 0 multiplexer ports.
<suppressed ~3 debug messages>

4.11. Executing OPT_REDUCE pass (consolidate $*mux and $reduce_* inputs).
  Optimizing cells in module \td_fused_top_tdf11_l2_writeOutputs_171_running_sums_2.
  Optimizing cells in module \td_fused_top_tdf11_l2_writeOutputs_171_running_sums_2_ram.
Performed a total of 0 changes.

4.12. Executing OPT_MERGE pass (detect identical cells).
Finding identical cells in module `\td_fused_top_tdf11_l2_writeOutputs_171_running_sums_2'.
Finding identical cells in module `\td_fused_top_tdf11_l2_writeOutputs_171_running_sums_2_ram'.
Removed a total of 0 cells.

4.13. Executing OPT_DFF pass (perform DFF optimizations).

4.14. Executing OPT_CLEAN pass (remove unused cells and wires).
Finding unused cells or wires in module \td_fused_top_tdf11_l2_writeOutputs_171_running_sums_2..
Finding unused cells or wires in module \td_fused_top_tdf11_l2_writeOutputs_171_running_sums_2_ram..

4.15. Executing OPT_EXPR pass (perform const folding).
Optimizing module td_fused_top_tdf11_l2_writeOutputs_171_running_sums_2.
Optimizing module td_fused_top_tdf11_l2_writeOutputs_171_running_sums_2_ram.

4.16. Finished OPT passes. (There is nothing left to do.)

5. Printing statistics.

=== td_fused_top_tdf11_l2_writeOutputs_171_running_sums_2 ===

   Number of wires:                  9
   Number of wire bits:             51
   Number of public wires:           9
   Number of public wire bits:      51
   Number of memories:               0
   Number of memory bits:            0
   Number of processes:              0
   Number of cells:                  1

=== td_fused_top_tdf11_l2_writeOutputs_171_running_sums_2_ram ===

   Number of wires:                 15
   Number of wire bits:            144
   Number of public wires:           8
   Number of public wire bits:      50
   Number of memories:               1
   Number of memory bits:         2048
   Number of processes:              0
   Number of cells:                  9
     $dffe                          16
     $mux                           48

=== design hierarchy ===

   td_fused_top_tdf11_l2_writeOutputs_171_running_sums_2      1
     td_fused_top_tdf11_l2_writeOutputs_171_running_sums_2_ram      0

   Number of wires:                  9
   Number of wire bits:             51
   Number of public wires:           9
   Number of public wire bits:      51
   Number of memories:               0
   Number of memory bits:            0
   Number of processes:              0
   Number of cells:                  1

End of script. Logfile hash: 1f37b871e6, CPU: user 0.02s system 0.00s, MEM: 11.67 MB peak
Yosys 0.10+12 (git sha1 72fac04, gcc 7.4.0-1ubuntu1~16.04~ppa1 -fPIC -Os)
Time spent: 39% 4x opt_expr (0 sec), 19% 3x opt_merge (0 sec), ...
