
 /----------------------------------------------------------------------------\
 |                                                                            |
 |  yosys -- Yosys Open SYnthesis Suite                                       |
 |                                                                            |
 |  Copyright (C) 2012 - 2020  Claire Xenia Wolf <claire@yosyshq.com>         |
 |                                                                            |
 |  Permission to use, copy, modify, and/or distribute this software for any  |
 |  purpose with or without fee is hereby granted, provided that the above    |
 |  copyright notice and this permission notice appear in all copies.         |
 |                                                                            |
 |  THE SOFTWARE IS PROVIDED "AS IS" AND THE AUTHOR DISCLAIMS ALL WARRANTIES  |
 |  WITH REGARD TO THIS SOFTWARE INCLUDING ALL IMPLIED WARRANTIES OF          |
 |  MERCHANTABILITY AND FITNESS. IN NO EVENT SHALL THE AUTHOR BE LIABLE FOR   |
 |  ANY SPECIAL, DIRECT, INDIRECT, OR CONSEQUENTIAL DAMAGES OR ANY DAMAGES    |
 |  WHATSOEVER RESULTING FROM LOSS OF USE, DATA OR PROFITS, WHETHER IN AN     |
 |  ACTION OF CONTRACT, NEGLIGENCE OR OTHER TORTIOUS ACTION, ARISING OUT OF   |
 |  OR IN CONNECTION WITH THE USE OR PERFORMANCE OF THIS SOFTWARE.            |
 |                                                                            |
 \----------------------------------------------------------------------------/

 Yosys 0.10+12 (git sha1 72fac04, gcc 7.4.0-1ubuntu1~16.04~ppa1 -fPIC -Os)


-- Executing script file `out.ys' --

1. Executing Verilog-2005 frontend: /home/zhigang/raw_data/raw_designs/vtr_designs/verilog/LU32PEEng_submodules/div_24b.v
Parsing SystemVerilog input from `/home/zhigang/raw_data/raw_designs/vtr_designs/verilog/LU32PEEng_submodules/div_24b.v' to AST representation.
Generating RTLIL representation for module `\div_24b'.
Note: Assuming pure combinatorial block at /home/zhigang/raw_data/raw_designs/vtr_designs/verilog/LU32PEEng_submodules/div_24b.v:228.2-420.5 in
compliance with IEC 62142(E):2005 / IEEE Std. 1364.1(E):2002. Recommending
use of @* instead of @(...) for better match of synthesis and simulation.
Successfully finished Verilog frontend.

2. Executing HIERARCHY pass (managing design hierarchy).

2.1. Finding top of design hierarchy..
root of   0 design levels: div_24b             
Automatically selected div_24b as design top module.

2.2. Analyzing design hierarchy..
Top module:  \div_24b

2.3. Analyzing design hierarchy..
Top module:  \div_24b
Removed 0 unused modules.

3. Executing PROC pass (convert processes to netlists).

3.1. Executing PROC_CLEAN pass (remove empty switches from decision trees).
Cleaned up 0 empty switches.

3.2. Executing PROC_RMDEAD pass (remove dead branches from decision trees).
Marked 24 switch rules as full_case in process $proc$/home/zhigang/raw_data/raw_designs/vtr_designs/verilog/LU32PEEng_submodules/div_24b.v:228$1 in module div_24b.
Removed a total of 0 dead cases.

3.3. Executing PROC_PRUNE pass (remove redundant assignments in processes).
Removed 0 redundant assignments.
Promoted 47 assignments to connections.

3.4. Executing PROC_INIT pass (extract init attributes).

3.5. Executing PROC_ARST pass (detect async resets in processes).

3.6. Executing PROC_MUX pass (convert decision trees to multiplexers).
Creating decoders for process `\div_24b.$proc$/home/zhigang/raw_data/raw_designs/vtr_designs/verilog/LU32PEEng_submodules/div_24b.v:228$1'.
     1/47: $24\res[0:0]
     2/47: $1\numer0[46:0]
     3/47: $23\res[1:1]
     4/47: $1\numer1[46:0]
     5/47: $22\res[2:2]
     6/47: $1\numer2[46:0]
     7/47: $21\res[3:3]
     8/47: $1\numer3[46:0]
     9/47: $20\res[4:4]
    10/47: $1\numer4[46:0]
    11/47: $19\res[5:5]
    12/47: $1\numer5[46:0]
    13/47: $18\res[6:6]
    14/47: $1\numer6[46:0]
    15/47: $17\res[7:7]
    16/47: $1\numer7[46:0]
    17/47: $16\res[8:8]
    18/47: $1\numer8[46:0]
    19/47: $15\res[9:9]
    20/47: $1\numer9[46:0]
    21/47: $14\res[10:10]
    22/47: $1\numer10[46:0]
    23/47: $13\res[11:11]
    24/47: $1\numer11[46:0]
    25/47: $12\res[12:12]
    26/47: $1\numer12[46:0]
    27/47: $11\res[13:13]
    28/47: $1\numer13[46:0]
    29/47: $10\res[14:14]
    30/47: $1\numer14[46:0]
    31/47: $9\res[15:15]
    32/47: $1\numer15[46:0]
    33/47: $8\res[16:16]
    34/47: $1\numer16[46:0]
    35/47: $7\res[17:17]
    36/47: $1\numer17[46:0]
    37/47: $6\res[18:18]
    38/47: $1\numer18[46:0]
    39/47: $5\res[19:19]
    40/47: $1\numer19[46:0]
    41/47: $4\res[20:20]
    42/47: $1\numer20[46:0]
    43/47: $3\res[21:21]
    44/47: $1\numer21[46:0]
    45/47: $2\res[22:22]
    46/47: $1\numer22[46:0]
    47/47: $1\res[23:23]

3.7. Executing PROC_DLATCH pass (convert process syncs to latches).
No latch inferred for signal `\div_24b.\res' from process `\div_24b.$proc$/home/zhigang/raw_data/raw_designs/vtr_designs/verilog/LU32PEEng_submodules/div_24b.v:228$1'.
No latch inferred for signal `\div_24b.\numer22' from process `\div_24b.$proc$/home/zhigang/raw_data/raw_designs/vtr_designs/verilog/LU32PEEng_submodules/div_24b.v:228$1'.
No latch inferred for signal `\div_24b.\numer21' from process `\div_24b.$proc$/home/zhigang/raw_data/raw_designs/vtr_designs/verilog/LU32PEEng_submodules/div_24b.v:228$1'.
No latch inferred for signal `\div_24b.\numer20' from process `\div_24b.$proc$/home/zhigang/raw_data/raw_designs/vtr_designs/verilog/LU32PEEng_submodules/div_24b.v:228$1'.
No latch inferred for signal `\div_24b.\numer19' from process `\div_24b.$proc$/home/zhigang/raw_data/raw_designs/vtr_designs/verilog/LU32PEEng_submodules/div_24b.v:228$1'.
No latch inferred for signal `\div_24b.\numer18' from process `\div_24b.$proc$/home/zhigang/raw_data/raw_designs/vtr_designs/verilog/LU32PEEng_submodules/div_24b.v:228$1'.
No latch inferred for signal `\div_24b.\numer17' from process `\div_24b.$proc$/home/zhigang/raw_data/raw_designs/vtr_designs/verilog/LU32PEEng_submodules/div_24b.v:228$1'.
No latch inferred for signal `\div_24b.\numer16' from process `\div_24b.$proc$/home/zhigang/raw_data/raw_designs/vtr_designs/verilog/LU32PEEng_submodules/div_24b.v:228$1'.
No latch inferred for signal `\div_24b.\numer15' from process `\div_24b.$proc$/home/zhigang/raw_data/raw_designs/vtr_designs/verilog/LU32PEEng_submodules/div_24b.v:228$1'.
No latch inferred for signal `\div_24b.\numer14' from process `\div_24b.$proc$/home/zhigang/raw_data/raw_designs/vtr_designs/verilog/LU32PEEng_submodules/div_24b.v:228$1'.
No latch inferred for signal `\div_24b.\numer13' from process `\div_24b.$proc$/home/zhigang/raw_data/raw_designs/vtr_designs/verilog/LU32PEEng_submodules/div_24b.v:228$1'.
No latch inferred for signal `\div_24b.\numer12' from process `\div_24b.$proc$/home/zhigang/raw_data/raw_designs/vtr_designs/verilog/LU32PEEng_submodules/div_24b.v:228$1'.
No latch inferred for signal `\div_24b.\numer11' from process `\div_24b.$proc$/home/zhigang/raw_data/raw_designs/vtr_designs/verilog/LU32PEEng_submodules/div_24b.v:228$1'.
No latch inferred for signal `\div_24b.\numer10' from process `\div_24b.$proc$/home/zhigang/raw_data/raw_designs/vtr_designs/verilog/LU32PEEng_submodules/div_24b.v:228$1'.
No latch inferred for signal `\div_24b.\numer9' from process `\div_24b.$proc$/home/zhigang/raw_data/raw_designs/vtr_designs/verilog/LU32PEEng_submodules/div_24b.v:228$1'.
No latch inferred for signal `\div_24b.\numer8' from process `\div_24b.$proc$/home/zhigang/raw_data/raw_designs/vtr_designs/verilog/LU32PEEng_submodules/div_24b.v:228$1'.
No latch inferred for signal `\div_24b.\numer7' from process `\div_24b.$proc$/home/zhigang/raw_data/raw_designs/vtr_designs/verilog/LU32PEEng_submodules/div_24b.v:228$1'.
No latch inferred for signal `\div_24b.\numer6' from process `\div_24b.$proc$/home/zhigang/raw_data/raw_designs/vtr_designs/verilog/LU32PEEng_submodules/div_24b.v:228$1'.
No latch inferred for signal `\div_24b.\numer5' from process `\div_24b.$proc$/home/zhigang/raw_data/raw_designs/vtr_designs/verilog/LU32PEEng_submodules/div_24b.v:228$1'.
No latch inferred for signal `\div_24b.\numer4' from process `\div_24b.$proc$/home/zhigang/raw_data/raw_designs/vtr_designs/verilog/LU32PEEng_submodules/div_24b.v:228$1'.
No latch inferred for signal `\div_24b.\numer3' from process `\div_24b.$proc$/home/zhigang/raw_data/raw_designs/vtr_designs/verilog/LU32PEEng_submodules/div_24b.v:228$1'.
No latch inferred for signal `\div_24b.\numer2' from process `\div_24b.$proc$/home/zhigang/raw_data/raw_designs/vtr_designs/verilog/LU32PEEng_submodules/div_24b.v:228$1'.
No latch inferred for signal `\div_24b.\numer1' from process `\div_24b.$proc$/home/zhigang/raw_data/raw_designs/vtr_designs/verilog/LU32PEEng_submodules/div_24b.v:228$1'.
No latch inferred for signal `\div_24b.\numer0' from process `\div_24b.$proc$/home/zhigang/raw_data/raw_designs/vtr_designs/verilog/LU32PEEng_submodules/div_24b.v:228$1'.

3.8. Executing PROC_DFF pass (convert process syncs to FFs).

3.9. Executing PROC_MEMWR pass (convert process memory writes to cells).

3.10. Executing PROC_CLEAN pass (remove empty switches from decision trees).
Found and cleaned up 24 empty switches in `\div_24b.$proc$/home/zhigang/raw_data/raw_designs/vtr_designs/verilog/LU32PEEng_submodules/div_24b.v:228$1'.
Removing empty process `div_24b.$proc$/home/zhigang/raw_data/raw_designs/vtr_designs/verilog/LU32PEEng_submodules/div_24b.v:228$1'.
Cleaned up 24 empty switches.

3.11. Executing OPT_EXPR pass (perform const folding).
Optimizing module div_24b.

4. Executing OPT pass (performing simple optimizations).

4.1. Executing OPT_EXPR pass (perform const folding).
Optimizing module div_24b.

4.2. Executing OPT_MERGE pass (detect identical cells).
Finding identical cells in module `\div_24b'.
Removed a total of 0 cells.

4.3. Executing OPT_MUXTREE pass (detect dead branches in mux trees).
Running muxtree optimizer on module \div_24b..
  Creating internal representation of mux trees.
  Evaluating internal representation of mux trees.
  Analyzing evaluation results.
Removed 0 multiplexer ports.
<suppressed ~47 debug messages>

4.4. Executing OPT_REDUCE pass (consolidate $*mux and $reduce_* inputs).
  Optimizing cells in module \div_24b.
Performed a total of 0 changes.

4.5. Executing OPT_MERGE pass (detect identical cells).
Finding identical cells in module `\div_24b'.
Removed a total of 0 cells.

4.6. Executing OPT_DFF pass (perform DFF optimizations).

4.7. Executing OPT_CLEAN pass (remove unused cells and wires).
Finding unused cells or wires in module \div_24b..
Removed 0 unused cells and 165 unused wires.
<suppressed ~1 debug messages>

4.8. Executing OPT_EXPR pass (perform const folding).
Optimizing module div_24b.

4.9. Rerunning OPT passes. (Maybe there is more to do..)

4.10. Executing OPT_MUXTREE pass (detect dead branches in mux trees).
Running muxtree optimizer on module \div_24b..
  Creating internal representation of mux trees.
  Evaluating internal representation of mux trees.
  Analyzing evaluation results.
Removed 0 multiplexer ports.
<suppressed ~47 debug messages>

4.11. Executing OPT_REDUCE pass (consolidate $*mux and $reduce_* inputs).
  Optimizing cells in module \div_24b.
Performed a total of 0 changes.

4.12. Executing OPT_MERGE pass (detect identical cells).
Finding identical cells in module `\div_24b'.
Removed a total of 0 cells.

4.13. Executing OPT_DFF pass (perform DFF optimizations).

4.14. Executing OPT_CLEAN pass (remove unused cells and wires).
Finding unused cells or wires in module \div_24b..

4.15. Executing OPT_EXPR pass (perform const folding).
Optimizing module div_24b.

4.16. Finished OPT passes. (There is nothing left to do.)

5. Printing statistics.

=== div_24b ===

   Number of wires:                 75
   Number of wire bits:           2076
   Number of public wires:          28
   Number of public wire bits:    1247
   Number of memories:               0
   Number of memory bits:            0
   Number of processes:              0
   Number of cells:                 94
     $le                           852
     $mux                         1105
     $sub                          805

End of script. Logfile hash: 6b4d42f3d3, CPU: user 0.13s system 0.00s, MEM: 14.25 MB peak
Yosys 0.10+12 (git sha1 72fac04, gcc 7.4.0-1ubuntu1~16.04~ppa1 -fPIC -Os)
Time spent: 24% 4x opt_expr (0 sec), 21% 2x read_verilog (0 sec), ...
