
 /----------------------------------------------------------------------------\
 |                                                                            |
 |  yosys -- Yosys Open SYnthesis Suite                                       |
 |                                                                            |
 |  Copyright (C) 2012 - 2020  Claire Xenia Wolf <claire@yosyshq.com>         |
 |                                                                            |
 |  Permission to use, copy, modify, and/or distribute this software for any  |
 |  purpose with or without fee is hereby granted, provided that the above    |
 |  copyright notice and this permission notice appear in all copies.         |
 |                                                                            |
 |  THE SOFTWARE IS PROVIDED "AS IS" AND THE AUTHOR DISCLAIMS ALL WARRANTIES  |
 |  WITH REGARD TO THIS SOFTWARE INCLUDING ALL IMPLIED WARRANTIES OF          |
 |  MERCHANTABILITY AND FITNESS. IN NO EVENT SHALL THE AUTHOR BE LIABLE FOR   |
 |  ANY SPECIAL, DIRECT, INDIRECT, OR CONSEQUENTIAL DAMAGES OR ANY DAMAGES    |
 |  WHATSOEVER RESULTING FROM LOSS OF USE, DATA OR PROFITS, WHETHER IN AN     |
 |  ACTION OF CONTRACT, NEGLIGENCE OR OTHER TORTIOUS ACTION, ARISING OUT OF   |
 |  OR IN CONNECTION WITH THE USE OR PERFORMANCE OF THIS SOFTWARE.            |
 |                                                                            |
 \----------------------------------------------------------------------------/

 Yosys 0.10+12 (git sha1 72fac04, gcc 7.4.0-1ubuntu1~16.04~ppa1 -fPIC -Os)


-- Executing script file `out.ys' --

1. Executing Verilog-2005 frontend: /home/zhigang/raw_data/raw_designs/vtr_designs/verilog/LU32PEEng_submodules/top_ram.v
Parsing SystemVerilog input from `/home/zhigang/raw_data/raw_designs/vtr_designs/verilog/LU32PEEng_submodules/top_ram.v' to AST representation.
Generating RTLIL representation for module `\top_ram'.
Generating RTLIL representation for module `\dual_port_ram'.
Successfully finished Verilog frontend.

2. Executing HIERARCHY pass (managing design hierarchy).

2.1. Finding top of design hierarchy..
root of   0 design levels: dual_port_ram       
root of   1 design levels: top_ram             
Automatically selected top_ram as design top module.

2.2. Analyzing design hierarchy..
Top module:  \top_ram
Used module:     \dual_port_ram
Parameter \DATA_WIDTH = 32
Parameter \ADDR_WIDTH = 12

2.3. Executing AST frontend in derive mode using pre-parsed AST for module `\dual_port_ram'.
Parameter \DATA_WIDTH = 32
Parameter \ADDR_WIDTH = 12
Generating RTLIL representation for module `$paramod$a3a4604214f38cbc11b6417a7ced6aedc2ba9f1f\dual_port_ram'.

2.4. Analyzing design hierarchy..
Top module:  \top_ram
Used module:     $paramod$a3a4604214f38cbc11b6417a7ced6aedc2ba9f1f\dual_port_ram

2.5. Analyzing design hierarchy..
Top module:  \top_ram
Used module:     $paramod$a3a4604214f38cbc11b6417a7ced6aedc2ba9f1f\dual_port_ram
Removing unused module `\dual_port_ram'.
Removed 1 unused modules.

3. Executing PROC pass (convert processes to netlists).

3.1. Executing PROC_CLEAN pass (remove empty switches from decision trees).
Cleaned up 0 empty switches.

3.2. Executing PROC_RMDEAD pass (remove dead branches from decision trees).
Marked 1 switch rules as full_case in process $proc$/home/zhigang/raw_data/raw_designs/vtr_designs/verilog/LU32PEEng_submodules/top_ram.v:262$31 in module $paramod$a3a4604214f38cbc11b6417a7ced6aedc2ba9f1f\dual_port_ram.
Marked 1 switch rules as full_case in process $proc$/home/zhigang/raw_data/raw_designs/vtr_designs/verilog/LU32PEEng_submodules/top_ram.v:253$23 in module $paramod$a3a4604214f38cbc11b6417a7ced6aedc2ba9f1f\dual_port_ram.
Removed a total of 0 dead cases.

3.3. Executing PROC_PRUNE pass (remove redundant assignments in processes).
Removed 0 redundant assignments.
Promoted 6 assignments to connections.

3.4. Executing PROC_INIT pass (extract init attributes).

3.5. Executing PROC_ARST pass (detect async resets in processes).

3.6. Executing PROC_MUX pass (convert decision trees to multiplexers).
Creating decoders for process `$paramod$a3a4604214f38cbc11b6417a7ced6aedc2ba9f1f\dual_port_ram.$proc$/home/zhigang/raw_data/raw_designs/vtr_designs/verilog/LU32PEEng_submodules/top_ram.v:262$31'.
     1/4: $1$memwr$\ram$/home/zhigang/raw_data/raw_designs/vtr_designs/verilog/LU32PEEng_submodules/top_ram.v:264$22_EN[31:0]$37
     2/4: $1$memwr$\ram$/home/zhigang/raw_data/raw_designs/vtr_designs/verilog/LU32PEEng_submodules/top_ram.v:264$22_DATA[31:0]$36
     3/4: $1$memwr$\ram$/home/zhigang/raw_data/raw_designs/vtr_designs/verilog/LU32PEEng_submodules/top_ram.v:264$22_ADDR[11:0]$35
     4/4: $0\out2[31:0]
Creating decoders for process `$paramod$a3a4604214f38cbc11b6417a7ced6aedc2ba9f1f\dual_port_ram.$proc$/home/zhigang/raw_data/raw_designs/vtr_designs/verilog/LU32PEEng_submodules/top_ram.v:253$23'.
     1/4: $1$memwr$\ram$/home/zhigang/raw_data/raw_designs/vtr_designs/verilog/LU32PEEng_submodules/top_ram.v:255$21_EN[31:0]$29
     2/4: $1$memwr$\ram$/home/zhigang/raw_data/raw_designs/vtr_designs/verilog/LU32PEEng_submodules/top_ram.v:255$21_DATA[31:0]$28
     3/4: $1$memwr$\ram$/home/zhigang/raw_data/raw_designs/vtr_designs/verilog/LU32PEEng_submodules/top_ram.v:255$21_ADDR[11:0]$27
     4/4: $0\out1[31:0]

3.7. Executing PROC_DLATCH pass (convert process syncs to latches).

3.8. Executing PROC_DFF pass (convert process syncs to FFs).
Creating register for signal `$paramod$a3a4604214f38cbc11b6417a7ced6aedc2ba9f1f\dual_port_ram.\out2' using process `$paramod$a3a4604214f38cbc11b6417a7ced6aedc2ba9f1f\dual_port_ram.$proc$/home/zhigang/raw_data/raw_designs/vtr_designs/verilog/LU32PEEng_submodules/top_ram.v:262$31'.
  created $dff cell `$procdff$63' with positive edge clock.
Creating register for signal `$paramod$a3a4604214f38cbc11b6417a7ced6aedc2ba9f1f\dual_port_ram.$memwr$\ram$/home/zhigang/raw_data/raw_designs/vtr_designs/verilog/LU32PEEng_submodules/top_ram.v:264$22_ADDR' using process `$paramod$a3a4604214f38cbc11b6417a7ced6aedc2ba9f1f\dual_port_ram.$proc$/home/zhigang/raw_data/raw_designs/vtr_designs/verilog/LU32PEEng_submodules/top_ram.v:262$31'.
  created $dff cell `$procdff$64' with positive edge clock.
Creating register for signal `$paramod$a3a4604214f38cbc11b6417a7ced6aedc2ba9f1f\dual_port_ram.$memwr$\ram$/home/zhigang/raw_data/raw_designs/vtr_designs/verilog/LU32PEEng_submodules/top_ram.v:264$22_DATA' using process `$paramod$a3a4604214f38cbc11b6417a7ced6aedc2ba9f1f\dual_port_ram.$proc$/home/zhigang/raw_data/raw_designs/vtr_designs/verilog/LU32PEEng_submodules/top_ram.v:262$31'.
  created $dff cell `$procdff$65' with positive edge clock.
Creating register for signal `$paramod$a3a4604214f38cbc11b6417a7ced6aedc2ba9f1f\dual_port_ram.$memwr$\ram$/home/zhigang/raw_data/raw_designs/vtr_designs/verilog/LU32PEEng_submodules/top_ram.v:264$22_EN' using process `$paramod$a3a4604214f38cbc11b6417a7ced6aedc2ba9f1f\dual_port_ram.$proc$/home/zhigang/raw_data/raw_designs/vtr_designs/verilog/LU32PEEng_submodules/top_ram.v:262$31'.
  created $dff cell `$procdff$66' with positive edge clock.
Creating register for signal `$paramod$a3a4604214f38cbc11b6417a7ced6aedc2ba9f1f\dual_port_ram.\out1' using process `$paramod$a3a4604214f38cbc11b6417a7ced6aedc2ba9f1f\dual_port_ram.$proc$/home/zhigang/raw_data/raw_designs/vtr_designs/verilog/LU32PEEng_submodules/top_ram.v:253$23'.
  created $dff cell `$procdff$67' with positive edge clock.
Creating register for signal `$paramod$a3a4604214f38cbc11b6417a7ced6aedc2ba9f1f\dual_port_ram.$memwr$\ram$/home/zhigang/raw_data/raw_designs/vtr_designs/verilog/LU32PEEng_submodules/top_ram.v:255$21_ADDR' using process `$paramod$a3a4604214f38cbc11b6417a7ced6aedc2ba9f1f\dual_port_ram.$proc$/home/zhigang/raw_data/raw_designs/vtr_designs/verilog/LU32PEEng_submodules/top_ram.v:253$23'.
  created $dff cell `$procdff$68' with positive edge clock.
Creating register for signal `$paramod$a3a4604214f38cbc11b6417a7ced6aedc2ba9f1f\dual_port_ram.$memwr$\ram$/home/zhigang/raw_data/raw_designs/vtr_designs/verilog/LU32PEEng_submodules/top_ram.v:255$21_DATA' using process `$paramod$a3a4604214f38cbc11b6417a7ced6aedc2ba9f1f\dual_port_ram.$proc$/home/zhigang/raw_data/raw_designs/vtr_designs/verilog/LU32PEEng_submodules/top_ram.v:253$23'.
  created $dff cell `$procdff$69' with positive edge clock.
Creating register for signal `$paramod$a3a4604214f38cbc11b6417a7ced6aedc2ba9f1f\dual_port_ram.$memwr$\ram$/home/zhigang/raw_data/raw_designs/vtr_designs/verilog/LU32PEEng_submodules/top_ram.v:255$21_EN' using process `$paramod$a3a4604214f38cbc11b6417a7ced6aedc2ba9f1f\dual_port_ram.$proc$/home/zhigang/raw_data/raw_designs/vtr_designs/verilog/LU32PEEng_submodules/top_ram.v:253$23'.
  created $dff cell `$procdff$70' with positive edge clock.

3.9. Executing PROC_MEMWR pass (convert process memory writes to cells).

3.10. Executing PROC_CLEAN pass (remove empty switches from decision trees).
Found and cleaned up 1 empty switch in `$paramod$a3a4604214f38cbc11b6417a7ced6aedc2ba9f1f\dual_port_ram.$proc$/home/zhigang/raw_data/raw_designs/vtr_designs/verilog/LU32PEEng_submodules/top_ram.v:262$31'.
Removing empty process `$paramod$a3a4604214f38cbc11b6417a7ced6aedc2ba9f1f\dual_port_ram.$proc$/home/zhigang/raw_data/raw_designs/vtr_designs/verilog/LU32PEEng_submodules/top_ram.v:262$31'.
Found and cleaned up 1 empty switch in `$paramod$a3a4604214f38cbc11b6417a7ced6aedc2ba9f1f\dual_port_ram.$proc$/home/zhigang/raw_data/raw_designs/vtr_designs/verilog/LU32PEEng_submodules/top_ram.v:253$23'.
Removing empty process `$paramod$a3a4604214f38cbc11b6417a7ced6aedc2ba9f1f\dual_port_ram.$proc$/home/zhigang/raw_data/raw_designs/vtr_designs/verilog/LU32PEEng_submodules/top_ram.v:253$23'.
Cleaned up 2 empty switches.

3.11. Executing OPT_EXPR pass (perform const folding).
Optimizing module $paramod$a3a4604214f38cbc11b6417a7ced6aedc2ba9f1f\dual_port_ram.
Optimizing module top_ram.

4. Executing OPT pass (performing simple optimizations).

4.1. Executing OPT_EXPR pass (perform const folding).
Optimizing module $paramod$a3a4604214f38cbc11b6417a7ced6aedc2ba9f1f\dual_port_ram.
Optimizing module top_ram.

4.2. Executing OPT_MERGE pass (detect identical cells).
Finding identical cells in module `$paramod$a3a4604214f38cbc11b6417a7ced6aedc2ba9f1f\dual_port_ram'.
Finding identical cells in module `\top_ram'.
Removed a total of 0 cells.

4.3. Executing OPT_MUXTREE pass (detect dead branches in mux trees).
Running muxtree optimizer on module $paramod$a3a4604214f38cbc11b6417a7ced6aedc2ba9f1f\dual_port_ram..
  Creating internal representation of mux trees.
  Evaluating internal representation of mux trees.
  Analyzing evaluation results.
Running muxtree optimizer on module \top_ram..
  Creating internal representation of mux trees.
  No muxes found in this module.
Removed 0 multiplexer ports.
<suppressed ~8 debug messages>

4.4. Executing OPT_REDUCE pass (consolidate $*mux and $reduce_* inputs).
  Optimizing cells in module $paramod$a3a4604214f38cbc11b6417a7ced6aedc2ba9f1f\dual_port_ram.
    Consolidated identical input bits for $mux cell $procmux$52:
      Old ports: A=0, B=32'11111111111111111111111111111111, Y=$procmux$52_Y
      New ports: A=1'0, B=1'1, Y=$procmux$52_Y [0]
      New connections: $procmux$52_Y [31:1] = { $procmux$52_Y [0] $procmux$52_Y [0] $procmux$52_Y [0] $procmux$52_Y [0] $procmux$52_Y [0] $procmux$52_Y [0] $procmux$52_Y [0] $procmux$52_Y [0] $procmux$52_Y [0] $procmux$52_Y [0] $procmux$52_Y [0] $procmux$52_Y [0] $procmux$52_Y [0] $procmux$52_Y [0] $procmux$52_Y [0] $procmux$52_Y [0] $procmux$52_Y [0] $procmux$52_Y [0] $procmux$52_Y [0] $procmux$52_Y [0] $procmux$52_Y [0] $procmux$52_Y [0] $procmux$52_Y [0] $procmux$52_Y [0] $procmux$52_Y [0] $procmux$52_Y [0] $procmux$52_Y [0] $procmux$52_Y [0] $procmux$52_Y [0] $procmux$52_Y [0] $procmux$52_Y [0] }
    Consolidated identical input bits for $mux cell $procmux$40:
      Old ports: A=0, B=32'11111111111111111111111111111111, Y=$procmux$40_Y
      New ports: A=1'0, B=1'1, Y=$procmux$40_Y [0]
      New connections: $procmux$40_Y [31:1] = { $procmux$40_Y [0] $procmux$40_Y [0] $procmux$40_Y [0] $procmux$40_Y [0] $procmux$40_Y [0] $procmux$40_Y [0] $procmux$40_Y [0] $procmux$40_Y [0] $procmux$40_Y [0] $procmux$40_Y [0] $procmux$40_Y [0] $procmux$40_Y [0] $procmux$40_Y [0] $procmux$40_Y [0] $procmux$40_Y [0] $procmux$40_Y [0] $procmux$40_Y [0] $procmux$40_Y [0] $procmux$40_Y [0] $procmux$40_Y [0] $procmux$40_Y [0] $procmux$40_Y [0] $procmux$40_Y [0] $procmux$40_Y [0] $procmux$40_Y [0] $procmux$40_Y [0] $procmux$40_Y [0] $procmux$40_Y [0] $procmux$40_Y [0] $procmux$40_Y [0] $procmux$40_Y [0] }
  Optimizing cells in module $paramod$a3a4604214f38cbc11b6417a7ced6aedc2ba9f1f\dual_port_ram.
  Optimizing cells in module \top_ram.
Performed a total of 2 changes.

4.5. Executing OPT_MERGE pass (detect identical cells).
Finding identical cells in module `$paramod$a3a4604214f38cbc11b6417a7ced6aedc2ba9f1f\dual_port_ram'.
Finding identical cells in module `\top_ram'.
Removed a total of 0 cells.

4.6. Executing OPT_DFF pass (perform DFF optimizations).
Adding EN signal on $procdff$63 ($dff) from module $paramod$a3a4604214f38cbc11b6417a7ced6aedc2ba9f1f\dual_port_ram (D = $memrd$\ram$/home/zhigang/raw_data/raw_designs/vtr_designs/verilog/LU32PEEng_submodules/top_ram.v:267$38_DATA, Q = \out2).
Adding EN signal on $procdff$67 ($dff) from module $paramod$a3a4604214f38cbc11b6417a7ced6aedc2ba9f1f\dual_port_ram (D = $memrd$\ram$/home/zhigang/raw_data/raw_designs/vtr_designs/verilog/LU32PEEng_submodules/top_ram.v:258$30_DATA, Q = \out1).

4.7. Executing OPT_CLEAN pass (remove unused cells and wires).
Finding unused cells or wires in module $paramod$a3a4604214f38cbc11b6417a7ced6aedc2ba9f1f\dual_port_ram..
Finding unused cells or wires in module \top_ram..
Removed 8 unused cells and 32 unused wires.
<suppressed ~10 debug messages>

4.8. Executing OPT_EXPR pass (perform const folding).
Optimizing module $paramod$a3a4604214f38cbc11b6417a7ced6aedc2ba9f1f\dual_port_ram.
Optimizing module top_ram.

4.9. Rerunning OPT passes. (Maybe there is more to do..)

4.10. Executing OPT_MUXTREE pass (detect dead branches in mux trees).
Running muxtree optimizer on module $paramod$a3a4604214f38cbc11b6417a7ced6aedc2ba9f1f\dual_port_ram..
  Creating internal representation of mux trees.
  Evaluating internal representation of mux trees.
  Analyzing evaluation results.
Running muxtree optimizer on module \top_ram..
  Creating internal representation of mux trees.
  No muxes found in this module.
Removed 0 multiplexer ports.
<suppressed ~6 debug messages>

4.11. Executing OPT_REDUCE pass (consolidate $*mux and $reduce_* inputs).
  Optimizing cells in module $paramod$a3a4604214f38cbc11b6417a7ced6aedc2ba9f1f\dual_port_ram.
  Optimizing cells in module \top_ram.
Performed a total of 0 changes.

4.12. Executing OPT_MERGE pass (detect identical cells).
Finding identical cells in module `$paramod$a3a4604214f38cbc11b6417a7ced6aedc2ba9f1f\dual_port_ram'.
Finding identical cells in module `\top_ram'.
Removed a total of 0 cells.

4.13. Executing OPT_DFF pass (perform DFF optimizations).

4.14. Executing OPT_CLEAN pass (remove unused cells and wires).
Finding unused cells or wires in module $paramod$a3a4604214f38cbc11b6417a7ced6aedc2ba9f1f\dual_port_ram..
Finding unused cells or wires in module \top_ram..

4.15. Executing OPT_EXPR pass (perform const folding).
Optimizing module $paramod$a3a4604214f38cbc11b6417a7ced6aedc2ba9f1f\dual_port_ram.
Optimizing module top_ram.

4.16. Finished OPT passes. (There is nothing left to do.)

5. Printing statistics.

=== $paramod$a3a4604214f38cbc11b6417a7ced6aedc2ba9f1f\dual_port_ram ===

   Number of wires:                 17
   Number of wire bits:            371
   Number of public wires:           9
   Number of public wire bits:     155
   Number of memories:               1
   Number of memory bits:          384
   Number of processes:              0
   Number of cells:                 12
     $dffe                          64
     $mux                           90

=== top_ram ===

   Number of wires:                  9
   Number of wire bits:            186
   Number of public wires:           9
   Number of public wire bits:     186
   Number of memories:               0
   Number of memory bits:            0
   Number of processes:              0
   Number of cells:                  3
     $and                           32
     $or                            32

=== design hierarchy ===

   top_ram                           1
     $paramod$a3a4604214f38cbc11b6417a7ced6aedc2ba9f1f\dual_port_ram      0

   Number of wires:                  9
   Number of wire bits:            186
   Number of public wires:           9
   Number of public wire bits:     186
   Number of memories:               0
   Number of memory bits:            0
   Number of processes:              0
   Number of cells:                  3
     $and                           32
     $or                            32

End of script. Logfile hash: b7b89e3e81, CPU: user 0.04s system 0.00s, MEM: 11.42 MB peak
Yosys 0.10+12 (git sha1 72fac04, gcc 7.4.0-1ubuntu1~16.04~ppa1 -fPIC -Os)
Time spent: 22% 4x opt_expr (0 sec), 22% 2x read_verilog (0 sec), ...
