
 /----------------------------------------------------------------------------\
 |                                                                            |
 |  yosys -- Yosys Open SYnthesis Suite                                       |
 |                                                                            |
 |  Copyright (C) 2012 - 2020  Claire Xenia Wolf <claire@yosyshq.com>         |
 |                                                                            |
 |  Permission to use, copy, modify, and/or distribute this software for any  |
 |  purpose with or without fee is hereby granted, provided that the above    |
 |  copyright notice and this permission notice appear in all copies.         |
 |                                                                            |
 |  THE SOFTWARE IS PROVIDED "AS IS" AND THE AUTHOR DISCLAIMS ALL WARRANTIES  |
 |  WITH REGARD TO THIS SOFTWARE INCLUDING ALL IMPLIED WARRANTIES OF          |
 |  MERCHANTABILITY AND FITNESS. IN NO EVENT SHALL THE AUTHOR BE LIABLE FOR   |
 |  ANY SPECIAL, DIRECT, INDIRECT, OR CONSEQUENTIAL DAMAGES OR ANY DAMAGES    |
 |  WHATSOEVER RESULTING FROM LOSS OF USE, DATA OR PROFITS, WHETHER IN AN     |
 |  ACTION OF CONTRACT, NEGLIGENCE OR OTHER TORTIOUS ACTION, ARISING OUT OF   |
 |  OR IN CONNECTION WITH THE USE OR PERFORMANCE OF THIS SOFTWARE.            |
 |                                                                            |
 \----------------------------------------------------------------------------/

 Yosys 0.10+12 (git sha1 72fac04, gcc 7.4.0-1ubuntu1~16.04~ppa1 -fPIC -Os)


-- Executing script file `out.ys' --

1. Executing Verilog-2005 frontend: /home/zhigang/raw_data/raw_designs/vtr_designs/verilog/koios/tiny_darknet_like.medium_submodules/FPAddSub_AlignShift1.v
Parsing SystemVerilog input from `/home/zhigang/raw_data/raw_designs/vtr_designs/verilog/koios/tiny_darknet_like.medium_submodules/FPAddSub_AlignShift1.v' to AST representation.
Generating RTLIL representation for module `\FPAddSub_AlignShift1'.
Successfully finished Verilog frontend.

2. Executing HIERARCHY pass (managing design hierarchy).

2.1. Finding top of design hierarchy..
root of   0 design levels: FPAddSub_AlignShift1
Automatically selected FPAddSub_AlignShift1 as design top module.

2.2. Analyzing design hierarchy..
Top module:  \FPAddSub_AlignShift1

2.3. Analyzing design hierarchy..
Top module:  \FPAddSub_AlignShift1
Removed 0 unused modules.

3. Executing PROC pass (convert processes to netlists).

3.1. Executing PROC_CLEAN pass (remove empty switches from decision trees).
Cleaned up 0 empty switches.

3.2. Executing PROC_RMDEAD pass (remove dead branches from decision trees).
Removed 1 dead cases from process $proc$/home/zhigang/raw_data/raw_designs/vtr_designs/verilog/koios/tiny_darknet_like.medium_submodules/FPAddSub_AlignShift1.v:43$5 in module FPAddSub_AlignShift1.
Marked 1 switch rules as full_case in process $proc$/home/zhigang/raw_data/raw_designs/vtr_designs/verilog/koios/tiny_darknet_like.medium_submodules/FPAddSub_AlignShift1.v:43$5 in module FPAddSub_AlignShift1.
Removed a total of 1 dead cases.

3.3. Executing PROC_PRUNE pass (remove redundant assignments in processes).
Removed 1 redundant assignment.
Promoted 2 assignments to connections.

3.4. Executing PROC_INIT pass (extract init attributes).

3.5. Executing PROC_ARST pass (detect async resets in processes).

3.6. Executing PROC_MUX pass (convert decision trees to multiplexers).
Creating decoders for process `\FPAddSub_AlignShift1.$proc$/home/zhigang/raw_data/raw_designs/vtr_designs/verilog/koios/tiny_darknet_like.medium_submodules/FPAddSub_AlignShift1.v:43$5'.
     1/12: $0\Lvl2[10:0] [10]
     2/12: $0\Lvl2[10:0] [8]
     3/12: $0\Lvl2[10:0] [7]
     4/12: $0\Lvl2[10:0] [6]
     5/12: $0\Lvl2[10:0] [5]
     6/12: $0\Lvl2[10:0] [4]
     7/12: $0\Lvl2[10:0] [3]
     8/12: $0\Lvl2[10:0] [2]
     9/12: $0\Lvl2[10:0] [1]
    10/12: $0\Lvl2[10:0] [0]
    11/12: $0\Lvl2[10:0] [9]
    12/12: $1\i[31:0]
Creating decoders for process `\FPAddSub_AlignShift1.$proc$/home/zhigang/raw_data/raw_designs/vtr_designs/verilog/koios/tiny_darknet_like.medium_submodules/FPAddSub_AlignShift1.v:34$3'.

3.7. Executing PROC_DLATCH pass (convert process syncs to latches).
No latch inferred for signal `\FPAddSub_AlignShift1.\Lvl2' from process `\FPAddSub_AlignShift1.$proc$/home/zhigang/raw_data/raw_designs/vtr_designs/verilog/koios/tiny_darknet_like.medium_submodules/FPAddSub_AlignShift1.v:43$5'.
Latch inferred for signal `\FPAddSub_AlignShift1.\i' from process `\FPAddSub_AlignShift1.$proc$/home/zhigang/raw_data/raw_designs/vtr_designs/verilog/koios/tiny_darknet_like.medium_submodules/FPAddSub_AlignShift1.v:43$5': $auto$proc_dlatch.cc:427:proc_dlatch$78
No latch inferred for signal `\FPAddSub_AlignShift1.\Lvl1' from process `\FPAddSub_AlignShift1.$proc$/home/zhigang/raw_data/raw_designs/vtr_designs/verilog/koios/tiny_darknet_like.medium_submodules/FPAddSub_AlignShift1.v:34$3'.

3.8. Executing PROC_DFF pass (convert process syncs to FFs).

3.9. Executing PROC_MEMWR pass (convert process memory writes to cells).

3.10. Executing PROC_CLEAN pass (remove empty switches from decision trees).
Found and cleaned up 1 empty switch in `\FPAddSub_AlignShift1.$proc$/home/zhigang/raw_data/raw_designs/vtr_designs/verilog/koios/tiny_darknet_like.medium_submodules/FPAddSub_AlignShift1.v:43$5'.
Removing empty process `FPAddSub_AlignShift1.$proc$/home/zhigang/raw_data/raw_designs/vtr_designs/verilog/koios/tiny_darknet_like.medium_submodules/FPAddSub_AlignShift1.v:43$5'.
Removing empty process `FPAddSub_AlignShift1.$proc$/home/zhigang/raw_data/raw_designs/vtr_designs/verilog/koios/tiny_darknet_like.medium_submodules/FPAddSub_AlignShift1.v:34$3'.
Cleaned up 1 empty switch.

3.11. Executing OPT_EXPR pass (perform const folding).
Optimizing module FPAddSub_AlignShift1.
<suppressed ~17 debug messages>

4. Executing OPT pass (performing simple optimizations).

4.1. Executing OPT_EXPR pass (perform const folding).
Optimizing module FPAddSub_AlignShift1.

4.2. Executing OPT_MERGE pass (detect identical cells).
Finding identical cells in module `\FPAddSub_AlignShift1'.
<suppressed ~132 debug messages>
Removed a total of 44 cells.

4.3. Executing OPT_MUXTREE pass (detect dead branches in mux trees).
Running muxtree optimizer on module \FPAddSub_AlignShift1..
  Creating internal representation of mux trees.
  Evaluating internal representation of mux trees.
  Analyzing evaluation results.
Removed 0 multiplexer ports.
<suppressed ~13 debug messages>

4.4. Executing OPT_REDUCE pass (consolidate $*mux and $reduce_* inputs).
  Optimizing cells in module \FPAddSub_AlignShift1.
    New ctrl vector for $pmux cell $procmux$21: { $procmux$65_CMP $procmux$64_CMP $auto$opt_reduce.cc:134:opt_mux$80 }
    New ctrl vector for $pmux cell $procmux$36: { $procmux$65_CMP $procmux$64_CMP $auto$opt_reduce.cc:134:opt_mux$82 }
    New ctrl vector for $pmux cell $procmux$16: { $procmux$65_CMP $auto$opt_reduce.cc:134:opt_mux$84 }
    New ctrl vector for $pmux cell $procmux$56: { $procmux$65_CMP $auto$opt_reduce.cc:134:opt_mux$86 }
    New ctrl vector for $pmux cell $procmux$31: { $procmux$65_CMP $procmux$64_CMP $auto$opt_reduce.cc:134:opt_mux$88 }
    New ctrl vector for $pmux cell $procmux$11: { $procmux$65_CMP $auto$opt_reduce.cc:134:opt_mux$90 }
    New ctrl vector for $pmux cell $procmux$26: { $procmux$65_CMP $procmux$64_CMP $auto$opt_reduce.cc:134:opt_mux$92 }
    New ctrl vector for $pmux cell $procmux$61: { }
    New ctrl vector for $pmux cell $procmux$6: { $procmux$65_CMP $auto$opt_reduce.cc:134:opt_mux$94 }
  Optimizing cells in module \FPAddSub_AlignShift1.
Performed a total of 9 changes.

4.5. Executing OPT_MERGE pass (detect identical cells).
Finding identical cells in module `\FPAddSub_AlignShift1'.
<suppressed ~18 debug messages>
Removed a total of 6 cells.

4.6. Executing OPT_DFF pass (perform DFF optimizations).

4.7. Executing OPT_CLEAN pass (remove unused cells and wires).
Finding unused cells or wires in module \FPAddSub_AlignShift1..
Removed 3 unused cells and 74 unused wires.
<suppressed ~5 debug messages>

4.8. Executing OPT_EXPR pass (perform const folding).
Optimizing module FPAddSub_AlignShift1.

4.9. Rerunning OPT passes. (Maybe there is more to do..)

4.10. Executing OPT_MUXTREE pass (detect dead branches in mux trees).
Running muxtree optimizer on module \FPAddSub_AlignShift1..
  Creating internal representation of mux trees.
  Evaluating internal representation of mux trees.
  Analyzing evaluation results.
Removed 0 multiplexer ports.
<suppressed ~12 debug messages>

4.11. Executing OPT_REDUCE pass (consolidate $*mux and $reduce_* inputs).
  Optimizing cells in module \FPAddSub_AlignShift1.
Performed a total of 0 changes.

4.12. Executing OPT_MERGE pass (detect identical cells).
Finding identical cells in module `\FPAddSub_AlignShift1'.
Removed a total of 0 cells.

4.13. Executing OPT_DFF pass (perform DFF optimizations).

4.14. Executing OPT_CLEAN pass (remove unused cells and wires).
Finding unused cells or wires in module \FPAddSub_AlignShift1..

4.15. Executing OPT_EXPR pass (perform const folding).
Optimizing module FPAddSub_AlignShift1.

4.16. Finished OPT passes. (There is nothing left to do.)

5. Printing statistics.

=== FPAddSub_AlignShift1 ===

   Number of wires:                 12
   Number of wire bits:             74
   Number of public wires:           6
   Number of public wire bits:      68
   Number of memories:               0
   Number of memory bits:            0
   Number of processes:              0
   Number of cells:                 18
     $eq                             6
     $logic_not                      2
     $mux                           11
     $pmux                          11
     $reduce_or                      5

End of script. Logfile hash: d5a71a7a8c, CPU: user 0.05s system 0.00s, MEM: 11.42 MB peak
Yosys 0.10+12 (git sha1 72fac04, gcc 7.4.0-1ubuntu1~16.04~ppa1 -fPIC -Os)
Time spent: 24% 4x opt_expr (0 sec), 16% 3x opt_merge (0 sec), ...
