
 /----------------------------------------------------------------------------\
 |                                                                            |
 |  yosys -- Yosys Open SYnthesis Suite                                       |
 |                                                                            |
 |  Copyright (C) 2012 - 2020  Claire Xenia Wolf <claire@yosyshq.com>         |
 |                                                                            |
 |  Permission to use, copy, modify, and/or distribute this software for any  |
 |  purpose with or without fee is hereby granted, provided that the above    |
 |  copyright notice and this permission notice appear in all copies.         |
 |                                                                            |
 |  THE SOFTWARE IS PROVIDED "AS IS" AND THE AUTHOR DISCLAIMS ALL WARRANTIES  |
 |  WITH REGARD TO THIS SOFTWARE INCLUDING ALL IMPLIED WARRANTIES OF          |
 |  MERCHANTABILITY AND FITNESS. IN NO EVENT SHALL THE AUTHOR BE LIABLE FOR   |
 |  ANY SPECIAL, DIRECT, INDIRECT, OR CONSEQUENTIAL DAMAGES OR ANY DAMAGES    |
 |  WHATSOEVER RESULTING FROM LOSS OF USE, DATA OR PROFITS, WHETHER IN AN     |
 |  ACTION OF CONTRACT, NEGLIGENCE OR OTHER TORTIOUS ACTION, ARISING OUT OF   |
 |  OR IN CONNECTION WITH THE USE OR PERFORMANCE OF THIS SOFTWARE.            |
 |                                                                            |
 \----------------------------------------------------------------------------/

 Yosys 0.10+12 (git sha1 72fac04, gcc 7.4.0-1ubuntu1~16.04~ppa1 -fPIC -Os)


-- Executing script file `out.ys' --

1. Executing Verilog-2005 frontend: /home/zhigang/raw_data/raw_designs/vtr_designs/verilog/koios/dla_like.small_submodules/dsp_block_16_8_false.v
Parsing SystemVerilog input from `/home/zhigang/raw_data/raw_designs/vtr_designs/verilog/koios/dla_like.small_submodules/dsp_block_16_8_false.v' to AST representation.
Generating RTLIL representation for module `\dsp_block_16_8_false'.
Successfully finished Verilog frontend.

2. Executing HIERARCHY pass (managing design hierarchy).

2.1. Finding top of design hierarchy..
root of   0 design levels: dsp_block_16_8_false
Automatically selected dsp_block_16_8_false as design top module.

2.2. Analyzing design hierarchy..
Top module:  \dsp_block_16_8_false

2.3. Analyzing design hierarchy..
Top module:  \dsp_block_16_8_false
Removed 0 unused modules.

3. Executing PROC pass (convert processes to netlists).

3.1. Executing PROC_CLEAN pass (remove empty switches from decision trees).
Cleaned up 0 empty switches.

3.2. Executing PROC_RMDEAD pass (remove dead branches from decision trees).
Marked 1 switch rules as full_case in process $proc$/home/zhigang/raw_data/raw_designs/vtr_designs/verilog/koios/dla_like.small_submodules/dsp_block_16_8_false.v:39$1 in module dsp_block_16_8_false.
Removed a total of 0 dead cases.

3.3. Executing PROC_PRUNE pass (remove redundant assignments in processes).
Removed 5 redundant assignments.
Promoted 0 assignments to connections.

3.4. Executing PROC_INIT pass (extract init attributes).

3.5. Executing PROC_ARST pass (detect async resets in processes).

3.6. Executing PROC_MUX pass (convert decision trees to multiplexers).
Creating decoders for process `\dsp_block_16_8_false.$proc$/home/zhigang/raw_data/raw_designs/vtr_designs/verilog/koios/dla_like.small_submodules/dsp_block_16_8_false.v:39$1'.
     1/5: $0\by_reg[7:0]
     2/5: $0\bx_reg[15:0]
     3/5: $0\ay_reg[7:0]
     4/5: $0\ax_reg[15:0]
     5/5: $0\resulta[23:0]

3.7. Executing PROC_DLATCH pass (convert process syncs to latches).

3.8. Executing PROC_DFF pass (convert process syncs to FFs).
Creating register for signal `\dsp_block_16_8_false.\resulta' using process `\dsp_block_16_8_false.$proc$/home/zhigang/raw_data/raw_designs/vtr_designs/verilog/koios/dla_like.small_submodules/dsp_block_16_8_false.v:39$1'.
  created $dff cell `$procdff$21' with positive edge clock.
Creating register for signal `\dsp_block_16_8_false.\ax_reg' using process `\dsp_block_16_8_false.$proc$/home/zhigang/raw_data/raw_designs/vtr_designs/verilog/koios/dla_like.small_submodules/dsp_block_16_8_false.v:39$1'.
  created $dff cell `$procdff$22' with positive edge clock.
Creating register for signal `\dsp_block_16_8_false.\ay_reg' using process `\dsp_block_16_8_false.$proc$/home/zhigang/raw_data/raw_designs/vtr_designs/verilog/koios/dla_like.small_submodules/dsp_block_16_8_false.v:39$1'.
  created $dff cell `$procdff$23' with positive edge clock.
Creating register for signal `\dsp_block_16_8_false.\bx_reg' using process `\dsp_block_16_8_false.$proc$/home/zhigang/raw_data/raw_designs/vtr_designs/verilog/koios/dla_like.small_submodules/dsp_block_16_8_false.v:39$1'.
  created $dff cell `$procdff$24' with positive edge clock.
Creating register for signal `\dsp_block_16_8_false.\by_reg' using process `\dsp_block_16_8_false.$proc$/home/zhigang/raw_data/raw_designs/vtr_designs/verilog/koios/dla_like.small_submodules/dsp_block_16_8_false.v:39$1'.
  created $dff cell `$procdff$25' with positive edge clock.

3.9. Executing PROC_MEMWR pass (convert process memory writes to cells).

3.10. Executing PROC_CLEAN pass (remove empty switches from decision trees).
Found and cleaned up 1 empty switch in `\dsp_block_16_8_false.$proc$/home/zhigang/raw_data/raw_designs/vtr_designs/verilog/koios/dla_like.small_submodules/dsp_block_16_8_false.v:39$1'.
Removing empty process `dsp_block_16_8_false.$proc$/home/zhigang/raw_data/raw_designs/vtr_designs/verilog/koios/dla_like.small_submodules/dsp_block_16_8_false.v:39$1'.
Cleaned up 1 empty switch.

3.11. Executing OPT_EXPR pass (perform const folding).
Optimizing module dsp_block_16_8_false.

4. Executing OPT pass (performing simple optimizations).

4.1. Executing OPT_EXPR pass (perform const folding).
Optimizing module dsp_block_16_8_false.

4.2. Executing OPT_MERGE pass (detect identical cells).
Finding identical cells in module `\dsp_block_16_8_false'.
Removed a total of 0 cells.

4.3. Executing OPT_MUXTREE pass (detect dead branches in mux trees).
Running muxtree optimizer on module \dsp_block_16_8_false..
  Creating internal representation of mux trees.
  Evaluating internal representation of mux trees.
  Analyzing evaluation results.
Removed 0 multiplexer ports.
<suppressed ~5 debug messages>

4.4. Executing OPT_REDUCE pass (consolidate $*mux and $reduce_* inputs).
  Optimizing cells in module \dsp_block_16_8_false.
Performed a total of 0 changes.

4.5. Executing OPT_MERGE pass (detect identical cells).
Finding identical cells in module `\dsp_block_16_8_false'.
Removed a total of 0 cells.

4.6. Executing OPT_DFF pass (perform DFF optimizations).
Adding SRST signal on $procdff$21 ($dff) from module dsp_block_16_8_false (D = $add$/home/zhigang/raw_data/raw_designs/vtr_designs/verilog/koios/dla_like.small_submodules/dsp_block_16_8_false.v:52$5_Y [23:0], Q = \resulta, rval = 24'000000000000000000000000).
Adding SRST signal on $procdff$22 ($dff) from module dsp_block_16_8_false (D = \ax, Q = \ax_reg, rval = 16'0000000000000000).
Adding SRST signal on $procdff$23 ($dff) from module dsp_block_16_8_false (D = \ay, Q = \ay_reg, rval = 8'00000000).
Adding SRST signal on $procdff$24 ($dff) from module dsp_block_16_8_false (D = \bx, Q = \bx_reg, rval = 16'0000000000000000).
Adding SRST signal on $procdff$25 ($dff) from module dsp_block_16_8_false (D = \by, Q = \by_reg, rval = 8'00000000).

4.7. Executing OPT_CLEAN pass (remove unused cells and wires).
Finding unused cells or wires in module \dsp_block_16_8_false..
Removed 5 unused cells and 15 unused wires.
<suppressed ~6 debug messages>

4.8. Executing OPT_EXPR pass (perform const folding).
Optimizing module dsp_block_16_8_false.

4.9. Rerunning OPT passes. (Maybe there is more to do..)

4.10. Executing OPT_MUXTREE pass (detect dead branches in mux trees).
Running muxtree optimizer on module \dsp_block_16_8_false..
  Creating internal representation of mux trees.
  No muxes found in this module.
Removed 0 multiplexer ports.

4.11. Executing OPT_REDUCE pass (consolidate $*mux and $reduce_* inputs).
  Optimizing cells in module \dsp_block_16_8_false.
Performed a total of 0 changes.

4.12. Executing OPT_MERGE pass (detect identical cells).
Finding identical cells in module `\dsp_block_16_8_false'.
Removed a total of 0 cells.

4.13. Executing OPT_DFF pass (perform DFF optimizations).

4.14. Executing OPT_CLEAN pass (remove unused cells and wires).
Finding unused cells or wires in module \dsp_block_16_8_false..

4.15. Executing OPT_EXPR pass (perform const folding).
Optimizing module dsp_block_16_8_false.

4.16. Finished OPT passes. (There is nothing left to do.)

5. Printing statistics.

=== dsp_block_16_8_false ===

   Number of wires:                 19
   Number of wire bits:            518
   Number of public wires:          15
   Number of public wire bits:     262
   Number of memories:               0
   Number of memory bits:            0
   Number of processes:              0
   Number of cells:                  9
     $add                          128
     $mul                          128
     $sdff                          72

End of script. Logfile hash: 6857c42c7c, CPU: user 0.02s system 0.00s, MEM: 11.53 MB peak
Yosys 0.10+12 (git sha1 72fac04, gcc 7.4.0-1ubuntu1~16.04~ppa1 -fPIC -Os)
Time spent: 33% 4x opt_expr (0 sec), 33% 3x opt_merge (0 sec), ...
