
 /----------------------------------------------------------------------------\
 |                                                                            |
 |  yosys -- Yosys Open SYnthesis Suite                                       |
 |                                                                            |
 |  Copyright (C) 2012 - 2020  Claire Xenia Wolf <claire@yosyshq.com>         |
 |                                                                            |
 |  Permission to use, copy, modify, and/or distribute this software for any  |
 |  purpose with or without fee is hereby granted, provided that the above    |
 |  copyright notice and this permission notice appear in all copies.         |
 |                                                                            |
 |  THE SOFTWARE IS PROVIDED "AS IS" AND THE AUTHOR DISCLAIMS ALL WARRANTIES  |
 |  WITH REGARD TO THIS SOFTWARE INCLUDING ALL IMPLIED WARRANTIES OF          |
 |  MERCHANTABILITY AND FITNESS. IN NO EVENT SHALL THE AUTHOR BE LIABLE FOR   |
 |  ANY SPECIAL, DIRECT, INDIRECT, OR CONSEQUENTIAL DAMAGES OR ANY DAMAGES    |
 |  WHATSOEVER RESULTING FROM LOSS OF USE, DATA OR PROFITS, WHETHER IN AN     |
 |  ACTION OF CONTRACT, NEGLIGENCE OR OTHER TORTIOUS ACTION, ARISING OUT OF   |
 |  OR IN CONNECTION WITH THE USE OR PERFORMANCE OF THIS SOFTWARE.            |
 |                                                                            |
 \----------------------------------------------------------------------------/

 Yosys 0.10+12 (git sha1 72fac04, gcc 7.4.0-1ubuntu1~16.04~ppa1 -fPIC -Os)


-- Executing script file `out.ys' --

1. Executing Verilog-2005 frontend: /home/zhigang/raw_data/raw_designs/vtr_designs/verilog/koios/dla_like.small_submodules/inverse_winograd_adder_30_3.v
Parsing SystemVerilog input from `/home/zhigang/raw_data/raw_designs/vtr_designs/verilog/koios/dla_like.small_submodules/inverse_winograd_adder_30_3.v' to AST representation.
Generating RTLIL representation for module `\inverse_winograd_adder_30_3'.
Successfully finished Verilog frontend.

2. Executing HIERARCHY pass (managing design hierarchy).

2.1. Finding top of design hierarchy..
root of   0 design levels: inverse_winograd_adder_30_3
Automatically selected inverse_winograd_adder_30_3 as design top module.

2.2. Analyzing design hierarchy..
Top module:  \inverse_winograd_adder_30_3

2.3. Analyzing design hierarchy..
Top module:  \inverse_winograd_adder_30_3
Removed 0 unused modules.

3. Executing PROC pass (convert processes to netlists).

3.1. Executing PROC_CLEAN pass (remove empty switches from decision trees).
Cleaned up 0 empty switches.

3.2. Executing PROC_RMDEAD pass (remove dead branches from decision trees).
Removed a total of 0 dead cases.

3.3. Executing PROC_PRUNE pass (remove redundant assignments in processes).
Removed 0 redundant assignments.
Promoted 6 assignments to connections.

3.4. Executing PROC_INIT pass (extract init attributes).

3.5. Executing PROC_ARST pass (detect async resets in processes).

3.6. Executing PROC_MUX pass (convert decision trees to multiplexers).
Creating decoders for process `\inverse_winograd_adder_30_3.$proc$/home/zhigang/raw_data/raw_designs/vtr_designs/verilog/koios/dla_like.small_submodules/inverse_winograd_adder_30_3.v:21$1'.

3.7. Executing PROC_DLATCH pass (convert process syncs to latches).

3.8. Executing PROC_DFF pass (convert process syncs to FFs).
Creating register for signal `\inverse_winograd_adder_30_3.\pipeline_0_0' using process `\inverse_winograd_adder_30_3.$proc$/home/zhigang/raw_data/raw_designs/vtr_designs/verilog/koios/dla_like.small_submodules/inverse_winograd_adder_30_3.v:21$1'.
  created $dff cell `$procdff$7' with positive edge clock.
Creating register for signal `\inverse_winograd_adder_30_3.\pipeline_0_1' using process `\inverse_winograd_adder_30_3.$proc$/home/zhigang/raw_data/raw_designs/vtr_designs/verilog/koios/dla_like.small_submodules/inverse_winograd_adder_30_3.v:21$1'.
  created $dff cell `$procdff$8' with positive edge clock.
Creating register for signal `\inverse_winograd_adder_30_3.\pipeline_0_2' using process `\inverse_winograd_adder_30_3.$proc$/home/zhigang/raw_data/raw_designs/vtr_designs/verilog/koios/dla_like.small_submodules/inverse_winograd_adder_30_3.v:21$1'.
  created $dff cell `$procdff$9' with positive edge clock.
Creating register for signal `\inverse_winograd_adder_30_3.\pipeline_1_0' using process `\inverse_winograd_adder_30_3.$proc$/home/zhigang/raw_data/raw_designs/vtr_designs/verilog/koios/dla_like.small_submodules/inverse_winograd_adder_30_3.v:21$1'.
  created $dff cell `$procdff$10' with positive edge clock.
Creating register for signal `\inverse_winograd_adder_30_3.\pipeline_1_1' using process `\inverse_winograd_adder_30_3.$proc$/home/zhigang/raw_data/raw_designs/vtr_designs/verilog/koios/dla_like.small_submodules/inverse_winograd_adder_30_3.v:21$1'.
  created $dff cell `$procdff$11' with positive edge clock.
Creating register for signal `\inverse_winograd_adder_30_3.\pipeline_2_0' using process `\inverse_winograd_adder_30_3.$proc$/home/zhigang/raw_data/raw_designs/vtr_designs/verilog/koios/dla_like.small_submodules/inverse_winograd_adder_30_3.v:21$1'.
  created $dff cell `$procdff$12' with positive edge clock.

3.9. Executing PROC_MEMWR pass (convert process memory writes to cells).

3.10. Executing PROC_CLEAN pass (remove empty switches from decision trees).
Removing empty process `inverse_winograd_adder_30_3.$proc$/home/zhigang/raw_data/raw_designs/vtr_designs/verilog/koios/dla_like.small_submodules/inverse_winograd_adder_30_3.v:21$1'.
Cleaned up 0 empty switches.

3.11. Executing OPT_EXPR pass (perform const folding).
Optimizing module inverse_winograd_adder_30_3.

4. Executing OPT pass (performing simple optimizations).

4.1. Executing OPT_EXPR pass (perform const folding).
Optimizing module inverse_winograd_adder_30_3.

4.2. Executing OPT_MERGE pass (detect identical cells).
Finding identical cells in module `\inverse_winograd_adder_30_3'.
Removed a total of 0 cells.

4.3. Executing OPT_MUXTREE pass (detect dead branches in mux trees).
Running muxtree optimizer on module \inverse_winograd_adder_30_3..
  Creating internal representation of mux trees.
  No muxes found in this module.
Removed 0 multiplexer ports.

4.4. Executing OPT_REDUCE pass (consolidate $*mux and $reduce_* inputs).
  Optimizing cells in module \inverse_winograd_adder_30_3.
Performed a total of 0 changes.

4.5. Executing OPT_MERGE pass (detect identical cells).
Finding identical cells in module `\inverse_winograd_adder_30_3'.
Removed a total of 0 cells.

4.6. Executing OPT_DFF pass (perform DFF optimizations).

4.7. Executing OPT_CLEAN pass (remove unused cells and wires).
Finding unused cells or wires in module \inverse_winograd_adder_30_3..
Removed 0 unused cells and 6 unused wires.
<suppressed ~1 debug messages>

4.8. Executing OPT_EXPR pass (perform const folding).
Optimizing module inverse_winograd_adder_30_3.

4.9. Rerunning OPT passes. (Maybe there is more to do..)

4.10. Executing OPT_MUXTREE pass (detect dead branches in mux trees).
Running muxtree optimizer on module \inverse_winograd_adder_30_3..
  Creating internal representation of mux trees.
  No muxes found in this module.
Removed 0 multiplexer ports.

4.11. Executing OPT_REDUCE pass (consolidate $*mux and $reduce_* inputs).
  Optimizing cells in module \inverse_winograd_adder_30_3.
Performed a total of 0 changes.

4.12. Executing OPT_MERGE pass (detect identical cells).
Finding identical cells in module `\inverse_winograd_adder_30_3'.
Removed a total of 0 cells.

4.13. Executing OPT_DFF pass (perform DFF optimizations).

4.14. Executing OPT_CLEAN pass (remove unused cells and wires).
Finding unused cells or wires in module \inverse_winograd_adder_30_3..

4.15. Executing OPT_EXPR pass (perform const folding).
Optimizing module inverse_winograd_adder_30_3.

4.16. Finished OPT passes. (There is nothing left to do.)

5. Printing statistics.

=== inverse_winograd_adder_30_3 ===

   Number of wires:                 19
   Number of wire bits:            574
   Number of public wires:          14
   Number of public wire bits:     409
   Number of memories:               0
   Number of memory bits:            0
   Number of processes:              0
   Number of cells:                 11
     $add                          165
     $dff                          198

End of script. Logfile hash: 55b4239b41, CPU: user 0.04s system 0.00s, MEM: 11.56 MB peak
Yosys 0.10+12 (git sha1 72fac04, gcc 7.4.0-1ubuntu1~16.04~ppa1 -fPIC -Os)
Time spent: 22% 4x opt_expr (0 sec), 22% 2x opt_dff (0 sec), ...
