
 /----------------------------------------------------------------------------\
 |                                                                            |
 |  yosys -- Yosys Open SYnthesis Suite                                       |
 |                                                                            |
 |  Copyright (C) 2012 - 2020  Claire Xenia Wolf <claire@yosyshq.com>         |
 |                                                                            |
 |  Permission to use, copy, modify, and/or distribute this software for any  |
 |  purpose with or without fee is hereby granted, provided that the above    |
 |  copyright notice and this permission notice appear in all copies.         |
 |                                                                            |
 |  THE SOFTWARE IS PROVIDED "AS IS" AND THE AUTHOR DISCLAIMS ALL WARRANTIES  |
 |  WITH REGARD TO THIS SOFTWARE INCLUDING ALL IMPLIED WARRANTIES OF          |
 |  MERCHANTABILITY AND FITNESS. IN NO EVENT SHALL THE AUTHOR BE LIABLE FOR   |
 |  ANY SPECIAL, DIRECT, INDIRECT, OR CONSEQUENTIAL DAMAGES OR ANY DAMAGES    |
 |  WHATSOEVER RESULTING FROM LOSS OF USE, DATA OR PROFITS, WHETHER IN AN     |
 |  ACTION OF CONTRACT, NEGLIGENCE OR OTHER TORTIOUS ACTION, ARISING OUT OF   |
 |  OR IN CONNECTION WITH THE USE OR PERFORMANCE OF THIS SOFTWARE.            |
 |                                                                            |
 \----------------------------------------------------------------------------/

 Yosys 0.10+12 (git sha1 72fac04, gcc 7.4.0-1ubuntu1~16.04~ppa1 -fPIC -Os)


-- Executing script file `out.ys' --

1. Executing Verilog-2005 frontend: /home/zhigang/raw_data/raw_designs/vtr_designs/verilog/koios/clstm_like.small_submodules/shift_register_unit_12.v
Parsing SystemVerilog input from `/home/zhigang/raw_data/raw_designs/vtr_designs/verilog/koios/clstm_like.small_submodules/shift_register_unit_12.v' to AST representation.
Generating RTLIL representation for module `\shift_register_unit_12'.
Successfully finished Verilog frontend.

2. Executing HIERARCHY pass (managing design hierarchy).

2.1. Finding top of design hierarchy..
root of   0 design levels: shift_register_unit_12
Automatically selected shift_register_unit_12 as design top module.

2.2. Analyzing design hierarchy..
Top module:  \shift_register_unit_12

2.3. Analyzing design hierarchy..
Top module:  \shift_register_unit_12
Removed 0 unused modules.

3. Executing PROC pass (convert processes to netlists).

3.1. Executing PROC_CLEAN pass (remove empty switches from decision trees).
Cleaned up 0 empty switches.

3.2. Executing PROC_RMDEAD pass (remove dead branches from decision trees).
Marked 1 switch rules as full_case in process $proc$/home/zhigang/raw_data/raw_designs/vtr_designs/verilog/koios/clstm_like.small_submodules/shift_register_unit_12.v:13$1 in module shift_register_unit_12.
Removed a total of 0 dead cases.

3.3. Executing PROC_PRUNE pass (remove redundant assignments in processes).
Removed 0 redundant assignments.
Promoted 0 assignments to connections.

3.4. Executing PROC_INIT pass (extract init attributes).

3.5. Executing PROC_ARST pass (detect async resets in processes).

3.6. Executing PROC_MUX pass (convert decision trees to multiplexers).
Creating decoders for process `\shift_register_unit_12.$proc$/home/zhigang/raw_data/raw_designs/vtr_designs/verilog/koios/clstm_like.small_submodules/shift_register_unit_12.v:13$1'.
     1/2: $0\shift_registers_1[0:0]
     2/2: $0\shift_registers_0[0:0]

3.7. Executing PROC_DLATCH pass (convert process syncs to latches).

3.8. Executing PROC_DFF pass (convert process syncs to FFs).
Creating register for signal `\shift_register_unit_12.\shift_registers_0' using process `\shift_register_unit_12.$proc$/home/zhigang/raw_data/raw_designs/vtr_designs/verilog/koios/clstm_like.small_submodules/shift_register_unit_12.v:13$1'.
  created $dff cell `$procdff$12' with positive edge clock.
Creating register for signal `\shift_register_unit_12.\shift_registers_1' using process `\shift_register_unit_12.$proc$/home/zhigang/raw_data/raw_designs/vtr_designs/verilog/koios/clstm_like.small_submodules/shift_register_unit_12.v:13$1'.
  created $dff cell `$procdff$13' with positive edge clock.

3.9. Executing PROC_MEMWR pass (convert process memory writes to cells).

3.10. Executing PROC_CLEAN pass (remove empty switches from decision trees).
Found and cleaned up 2 empty switches in `\shift_register_unit_12.$proc$/home/zhigang/raw_data/raw_designs/vtr_designs/verilog/koios/clstm_like.small_submodules/shift_register_unit_12.v:13$1'.
Removing empty process `shift_register_unit_12.$proc$/home/zhigang/raw_data/raw_designs/vtr_designs/verilog/koios/clstm_like.small_submodules/shift_register_unit_12.v:13$1'.
Cleaned up 2 empty switches.

3.11. Executing OPT_EXPR pass (perform const folding).
Optimizing module shift_register_unit_12.

4. Executing OPT pass (performing simple optimizations).

4.1. Executing OPT_EXPR pass (perform const folding).
Optimizing module shift_register_unit_12.

4.2. Executing OPT_MERGE pass (detect identical cells).
Finding identical cells in module `\shift_register_unit_12'.
Removed a total of 0 cells.

4.3. Executing OPT_MUXTREE pass (detect dead branches in mux trees).
Running muxtree optimizer on module \shift_register_unit_12..
  Creating internal representation of mux trees.
  Evaluating internal representation of mux trees.
  Analyzing evaluation results.
Removed 0 multiplexer ports.
<suppressed ~2 debug messages>

4.4. Executing OPT_REDUCE pass (consolidate $*mux and $reduce_* inputs).
  Optimizing cells in module \shift_register_unit_12.
Performed a total of 0 changes.

4.5. Executing OPT_MERGE pass (detect identical cells).
Finding identical cells in module `\shift_register_unit_12'.
Removed a total of 0 cells.

4.6. Executing OPT_DFF pass (perform DFF optimizations).
Adding SRST signal on $procdff$12 ($dff) from module shift_register_unit_12 (D = $procmux$7_Y, Q = \shift_registers_0, rval = 1'0).
Adding EN signal on $auto$ff.cc:262:slice$14 ($sdff) from module shift_register_unit_12 (D = \in, Q = \shift_registers_0).
Adding SRST signal on $procdff$13 ($dff) from module shift_register_unit_12 (D = $procmux$2_Y, Q = \shift_registers_1, rval = 1'0).
Adding EN signal on $auto$ff.cc:262:slice$16 ($sdff) from module shift_register_unit_12 (D = \shift_registers_0, Q = \shift_registers_1).

4.7. Executing OPT_CLEAN pass (remove unused cells and wires).
Finding unused cells or wires in module \shift_register_unit_12..
Removed 4 unused cells and 10 unused wires.
<suppressed ~5 debug messages>

4.8. Executing OPT_EXPR pass (perform const folding).
Optimizing module shift_register_unit_12.

4.9. Rerunning OPT passes. (Maybe there is more to do..)

4.10. Executing OPT_MUXTREE pass (detect dead branches in mux trees).
Running muxtree optimizer on module \shift_register_unit_12..
  Creating internal representation of mux trees.
  No muxes found in this module.
Removed 0 multiplexer ports.

4.11. Executing OPT_REDUCE pass (consolidate $*mux and $reduce_* inputs).
  Optimizing cells in module \shift_register_unit_12.
Performed a total of 0 changes.

4.12. Executing OPT_MERGE pass (detect identical cells).
Finding identical cells in module `\shift_register_unit_12'.
Removed a total of 0 cells.

4.13. Executing OPT_DFF pass (perform DFF optimizations).

4.14. Executing OPT_CLEAN pass (remove unused cells and wires).
Finding unused cells or wires in module \shift_register_unit_12..

4.15. Executing OPT_EXPR pass (perform const folding).
Optimizing module shift_register_unit_12.

4.16. Finished OPT passes. (There is nothing left to do.)

5. Printing statistics.

=== shift_register_unit_12 ===

   Number of wires:                  7
   Number of wire bits:              7
   Number of public wires:           7
   Number of public wire bits:       7
   Number of memories:               0
   Number of memory bits:            0
   Number of processes:              0
   Number of cells:                  2
     $sdffe                          2

End of script. Logfile hash: a84570e1ca, CPU: user 0.01s system 0.00s, MEM: 11.24 MB peak
Yosys 0.10+12 (git sha1 72fac04, gcc 7.4.0-1ubuntu1~16.04~ppa1 -fPIC -Os)
Time spent: 66% 4x opt_expr (0 sec), 33% 2x opt_clean (0 sec), ...
