
 /----------------------------------------------------------------------------\
 |                                                                            |
 |  yosys -- Yosys Open SYnthesis Suite                                       |
 |                                                                            |
 |  Copyright (C) 2012 - 2020  Claire Xenia Wolf <claire@yosyshq.com>         |
 |                                                                            |
 |  Permission to use, copy, modify, and/or distribute this software for any  |
 |  purpose with or without fee is hereby granted, provided that the above    |
 |  copyright notice and this permission notice appear in all copies.         |
 |                                                                            |
 |  THE SOFTWARE IS PROVIDED "AS IS" AND THE AUTHOR DISCLAIMS ALL WARRANTIES  |
 |  WITH REGARD TO THIS SOFTWARE INCLUDING ALL IMPLIED WARRANTIES OF          |
 |  MERCHANTABILITY AND FITNESS. IN NO EVENT SHALL THE AUTHOR BE LIABLE FOR   |
 |  ANY SPECIAL, DIRECT, INDIRECT, OR CONSEQUENTIAL DAMAGES OR ANY DAMAGES    |
 |  WHATSOEVER RESULTING FROM LOSS OF USE, DATA OR PROFITS, WHETHER IN AN     |
 |  ACTION OF CONTRACT, NEGLIGENCE OR OTHER TORTIOUS ACTION, ARISING OUT OF   |
 |  OR IN CONNECTION WITH THE USE OR PERFORMANCE OF THIS SOFTWARE.            |
 |                                                                            |
 \----------------------------------------------------------------------------/

 Yosys 0.10+12 (git sha1 72fac04, gcc 7.4.0-1ubuntu1~16.04~ppa1 -fPIC -Os)


-- Executing script file `out.ys' --

1. Executing Verilog-2005 frontend: /home/zhigang/raw_data/raw_designs/opencores/arithmetic/mod3_calc_submodules/type_conv.v
Parsing SystemVerilog input from `/home/zhigang/raw_data/raw_designs/opencores/arithmetic/mod3_calc_submodules/type_conv.v' to AST representation.
Generating RTLIL representation for module `\type_conv'.
Successfully finished Verilog frontend.

2. Executing HIERARCHY pass (managing design hierarchy).

2.1. Finding top of design hierarchy..
root of   0 design levels: type_conv           
Automatically selected type_conv as design top module.

2.2. Analyzing design hierarchy..
Top module:  \type_conv

2.3. Analyzing design hierarchy..
Top module:  \type_conv
Removed 0 unused modules.

3. Executing PROC pass (convert processes to netlists).

3.1. Executing PROC_CLEAN pass (remove empty switches from decision trees).
Cleaned up 0 empty switches.

3.2. Executing PROC_RMDEAD pass (remove dead branches from decision trees).
Removed 1 dead cases from process $proc$/home/zhigang/raw_data/raw_designs/opencores/arithmetic/mod3_calc_submodules/type_conv.v:8$1 in module type_conv.
Marked 1 switch rules as full_case in process $proc$/home/zhigang/raw_data/raw_designs/opencores/arithmetic/mod3_calc_submodules/type_conv.v:8$1 in module type_conv.
Removed a total of 1 dead cases.

3.3. Executing PROC_PRUNE pass (remove redundant assignments in processes).
Removed 0 redundant assignments.
Promoted 1 assignment to connection.

3.4. Executing PROC_INIT pass (extract init attributes).

3.5. Executing PROC_ARST pass (detect async resets in processes).

3.6. Executing PROC_MUX pass (convert decision trees to multiplexers).
Creating decoders for process `\type_conv.$proc$/home/zhigang/raw_data/raw_designs/opencores/arithmetic/mod3_calc_submodules/type_conv.v:8$1'.
     1/1: $1\dat_o[1:0]

3.7. Executing PROC_DLATCH pass (convert process syncs to latches).
No latch inferred for signal `\type_conv.\dat_o' from process `\type_conv.$proc$/home/zhigang/raw_data/raw_designs/opencores/arithmetic/mod3_calc_submodules/type_conv.v:8$1'.

3.8. Executing PROC_DFF pass (convert process syncs to FFs).

3.9. Executing PROC_MEMWR pass (convert process memory writes to cells).

3.10. Executing PROC_CLEAN pass (remove empty switches from decision trees).
Found and cleaned up 1 empty switch in `\type_conv.$proc$/home/zhigang/raw_data/raw_designs/opencores/arithmetic/mod3_calc_submodules/type_conv.v:8$1'.
Removing empty process `type_conv.$proc$/home/zhigang/raw_data/raw_designs/opencores/arithmetic/mod3_calc_submodules/type_conv.v:8$1'.
Cleaned up 1 empty switch.

3.11. Executing OPT_EXPR pass (perform const folding).
Optimizing module type_conv.
<suppressed ~1 debug messages>

4. Executing OPT pass (performing simple optimizations).

4.1. Executing OPT_EXPR pass (perform const folding).
Optimizing module type_conv.

4.2. Executing OPT_MERGE pass (detect identical cells).
Finding identical cells in module `\type_conv'.
Removed a total of 0 cells.

4.3. Executing OPT_MUXTREE pass (detect dead branches in mux trees).
Running muxtree optimizer on module \type_conv..
  Creating internal representation of mux trees.
  Evaluating internal representation of mux trees.
  Analyzing evaluation results.
Removed 0 multiplexer ports.
<suppressed ~1 debug messages>

4.4. Executing OPT_REDUCE pass (consolidate $*mux and $reduce_* inputs).
  Optimizing cells in module \type_conv.
    New ctrl vector for $pmux cell $procmux$2: { $procmux$5_CMP $procmux$4_CMP $auto$opt_reduce.cc:134:opt_mux$8 }
  Optimizing cells in module \type_conv.
Performed a total of 1 changes.

4.5. Executing OPT_MERGE pass (detect identical cells).
Finding identical cells in module `\type_conv'.
Removed a total of 0 cells.

4.6. Executing OPT_DFF pass (perform DFF optimizations).

4.7. Executing OPT_CLEAN pass (remove unused cells and wires).
Finding unused cells or wires in module \type_conv..
Removed 0 unused cells and 3 unused wires.
<suppressed ~1 debug messages>

4.8. Executing OPT_EXPR pass (perform const folding).
Optimizing module type_conv.

4.9. Rerunning OPT passes. (Maybe there is more to do..)

4.10. Executing OPT_MUXTREE pass (detect dead branches in mux trees).
Running muxtree optimizer on module \type_conv..
  Creating internal representation of mux trees.
  Evaluating internal representation of mux trees.
  Analyzing evaluation results.
Removed 0 multiplexer ports.
<suppressed ~1 debug messages>

4.11. Executing OPT_REDUCE pass (consolidate $*mux and $reduce_* inputs).
  Optimizing cells in module \type_conv.
Performed a total of 0 changes.

4.12. Executing OPT_MERGE pass (detect identical cells).
Finding identical cells in module `\type_conv'.
Removed a total of 0 cells.

4.13. Executing OPT_DFF pass (perform DFF optimizations).

4.14. Executing OPT_CLEAN pass (remove unused cells and wires).
Finding unused cells or wires in module \type_conv..

4.15. Executing OPT_EXPR pass (perform const folding).
Optimizing module type_conv.

4.16. Finished OPT passes. (There is nothing left to do.)

5. Printing statistics.

=== type_conv ===

   Number of wires:                  8
   Number of wire bits:              9
   Number of public wires:           3
   Number of public wire bits:       4
   Number of memories:               0
   Number of memory bits:            0
   Number of processes:              0
   Number of cells:                  6
     $eq                             6
     $logic_not                      2
     $pmux                           2
     $reduce_or                      2

End of script. Logfile hash: 9f10e8e45e, CPU: user 0.02s system 0.00s, MEM: 11.27 MB peak
Yosys 0.10+12 (git sha1 72fac04, gcc 7.4.0-1ubuntu1~16.04~ppa1 -fPIC -Os)
Time spent: 39% 3x opt_merge (0 sec), 19% 4x opt_expr (0 sec), ...
