
 /----------------------------------------------------------------------------\
 |                                                                            |
 |  yosys -- Yosys Open SYnthesis Suite                                       |
 |                                                                            |
 |  Copyright (C) 2012 - 2020  Claire Xenia Wolf <claire@yosyshq.com>         |
 |                                                                            |
 |  Permission to use, copy, modify, and/or distribute this software for any  |
 |  purpose with or without fee is hereby granted, provided that the above    |
 |  copyright notice and this permission notice appear in all copies.         |
 |                                                                            |
 |  THE SOFTWARE IS PROVIDED "AS IS" AND THE AUTHOR DISCLAIMS ALL WARRANTIES  |
 |  WITH REGARD TO THIS SOFTWARE INCLUDING ALL IMPLIED WARRANTIES OF          |
 |  MERCHANTABILITY AND FITNESS. IN NO EVENT SHALL THE AUTHOR BE LIABLE FOR   |
 |  ANY SPECIAL, DIRECT, INDIRECT, OR CONSEQUENTIAL DAMAGES OR ANY DAMAGES    |
 |  WHATSOEVER RESULTING FROM LOSS OF USE, DATA OR PROFITS, WHETHER IN AN     |
 |  ACTION OF CONTRACT, NEGLIGENCE OR OTHER TORTIOUS ACTION, ARISING OUT OF   |
 |  OR IN CONNECTION WITH THE USE OR PERFORMANCE OF THIS SOFTWARE.            |
 |                                                                            |
 \----------------------------------------------------------------------------/

 Yosys 0.10+12 (git sha1 72fac04, gcc 7.4.0-1ubuntu1~16.04~ppa1 -fPIC -Os)


-- Executing script file `out.ys' --

1. Executing Verilog-2005 frontend: /home/zhigang/raw_data/raw_designs/vtr_designs/verilog/koios/clstm_like.medium_submodules/dsp_signed_mac_18_13_23_32.v
Parsing SystemVerilog input from `/home/zhigang/raw_data/raw_designs/vtr_designs/verilog/koios/clstm_like.medium_submodules/dsp_signed_mac_18_13_23_32.v' to AST representation.
Generating RTLIL representation for module `\dsp_signed_mac_18_13_23_32'.
Successfully finished Verilog frontend.

2. Executing HIERARCHY pass (managing design hierarchy).

2.1. Finding top of design hierarchy..
root of   0 design levels: dsp_signed_mac_18_13_23_32
Automatically selected dsp_signed_mac_18_13_23_32 as design top module.

2.2. Analyzing design hierarchy..
Top module:  \dsp_signed_mac_18_13_23_32

2.3. Analyzing design hierarchy..
Top module:  \dsp_signed_mac_18_13_23_32
Removed 0 unused modules.

3. Executing PROC pass (convert processes to netlists).

3.1. Executing PROC_CLEAN pass (remove empty switches from decision trees).
Cleaned up 0 empty switches.

3.2. Executing PROC_RMDEAD pass (remove dead branches from decision trees).
Marked 1 switch rules as full_case in process $proc$/home/zhigang/raw_data/raw_designs/vtr_designs/verilog/koios/clstm_like.medium_submodules/dsp_signed_mac_18_13_23_32.v:35$4 in module dsp_signed_mac_18_13_23_32.
Marked 1 switch rules as full_case in process $proc$/home/zhigang/raw_data/raw_designs/vtr_designs/verilog/koios/clstm_like.medium_submodules/dsp_signed_mac_18_13_23_32.v:19$1 in module dsp_signed_mac_18_13_23_32.
Removed a total of 0 dead cases.

3.3. Executing PROC_PRUNE pass (remove redundant assignments in processes).
Removed 4 redundant assignments.
Promoted 0 assignments to connections.

3.4. Executing PROC_INIT pass (extract init attributes).

3.5. Executing PROC_ARST pass (detect async resets in processes).

3.6. Executing PROC_MUX pass (convert decision trees to multiplexers).
Creating decoders for process `\dsp_signed_mac_18_13_23_32.$proc$/home/zhigang/raw_data/raw_designs/vtr_designs/verilog/koios/clstm_like.medium_submodules/dsp_signed_mac_18_13_23_32.v:35$4'.
     1/3: $0\output_valid[0:0]
     2/3: $0\result_valid[0:0]
     3/3: $0\input_valid[0:0]
Creating decoders for process `\dsp_signed_mac_18_13_23_32.$proc$/home/zhigang/raw_data/raw_designs/vtr_designs/verilog/koios/clstm_like.medium_submodules/dsp_signed_mac_18_13_23_32.v:19$1'.
     1/4: $0\reg_res[31:0]
     2/4: $0\reg_az[22:0]
     3/4: $0\reg_ay[12:0]
     4/4: $0\reg_ax[17:0]

3.7. Executing PROC_DLATCH pass (convert process syncs to latches).

3.8. Executing PROC_DFF pass (convert process syncs to FFs).
Creating register for signal `\dsp_signed_mac_18_13_23_32.\input_valid' using process `\dsp_signed_mac_18_13_23_32.$proc$/home/zhigang/raw_data/raw_designs/vtr_designs/verilog/koios/clstm_like.medium_submodules/dsp_signed_mac_18_13_23_32.v:35$4'.
  created $dff cell `$procdff$32' with positive edge clock.
Creating register for signal `\dsp_signed_mac_18_13_23_32.\result_valid' using process `\dsp_signed_mac_18_13_23_32.$proc$/home/zhigang/raw_data/raw_designs/vtr_designs/verilog/koios/clstm_like.medium_submodules/dsp_signed_mac_18_13_23_32.v:35$4'.
  created $dff cell `$procdff$33' with positive edge clock.
Creating register for signal `\dsp_signed_mac_18_13_23_32.\output_valid' using process `\dsp_signed_mac_18_13_23_32.$proc$/home/zhigang/raw_data/raw_designs/vtr_designs/verilog/koios/clstm_like.medium_submodules/dsp_signed_mac_18_13_23_32.v:35$4'.
  created $dff cell `$procdff$34' with positive edge clock.
Creating register for signal `\dsp_signed_mac_18_13_23_32.\reg_ax' using process `\dsp_signed_mac_18_13_23_32.$proc$/home/zhigang/raw_data/raw_designs/vtr_designs/verilog/koios/clstm_like.medium_submodules/dsp_signed_mac_18_13_23_32.v:19$1'.
  created $dff cell `$procdff$35' with positive edge clock.
Creating register for signal `\dsp_signed_mac_18_13_23_32.\reg_ay' using process `\dsp_signed_mac_18_13_23_32.$proc$/home/zhigang/raw_data/raw_designs/vtr_designs/verilog/koios/clstm_like.medium_submodules/dsp_signed_mac_18_13_23_32.v:19$1'.
  created $dff cell `$procdff$36' with positive edge clock.
Creating register for signal `\dsp_signed_mac_18_13_23_32.\reg_az' using process `\dsp_signed_mac_18_13_23_32.$proc$/home/zhigang/raw_data/raw_designs/vtr_designs/verilog/koios/clstm_like.medium_submodules/dsp_signed_mac_18_13_23_32.v:19$1'.
  created $dff cell `$procdff$37' with positive edge clock.
Creating register for signal `\dsp_signed_mac_18_13_23_32.\reg_res' using process `\dsp_signed_mac_18_13_23_32.$proc$/home/zhigang/raw_data/raw_designs/vtr_designs/verilog/koios/clstm_like.medium_submodules/dsp_signed_mac_18_13_23_32.v:19$1'.
  created $dff cell `$procdff$38' with positive edge clock.

3.9. Executing PROC_MEMWR pass (convert process memory writes to cells).

3.10. Executing PROC_CLEAN pass (remove empty switches from decision trees).
Found and cleaned up 2 empty switches in `\dsp_signed_mac_18_13_23_32.$proc$/home/zhigang/raw_data/raw_designs/vtr_designs/verilog/koios/clstm_like.medium_submodules/dsp_signed_mac_18_13_23_32.v:35$4'.
Removing empty process `dsp_signed_mac_18_13_23_32.$proc$/home/zhigang/raw_data/raw_designs/vtr_designs/verilog/koios/clstm_like.medium_submodules/dsp_signed_mac_18_13_23_32.v:35$4'.
Found and cleaned up 1 empty switch in `\dsp_signed_mac_18_13_23_32.$proc$/home/zhigang/raw_data/raw_designs/vtr_designs/verilog/koios/clstm_like.medium_submodules/dsp_signed_mac_18_13_23_32.v:19$1'.
Removing empty process `dsp_signed_mac_18_13_23_32.$proc$/home/zhigang/raw_data/raw_designs/vtr_designs/verilog/koios/clstm_like.medium_submodules/dsp_signed_mac_18_13_23_32.v:19$1'.
Cleaned up 3 empty switches.

3.11. Executing OPT_EXPR pass (perform const folding).
Optimizing module dsp_signed_mac_18_13_23_32.

4. Executing OPT pass (performing simple optimizations).

4.1. Executing OPT_EXPR pass (perform const folding).
Optimizing module dsp_signed_mac_18_13_23_32.

4.2. Executing OPT_MERGE pass (detect identical cells).
Finding identical cells in module `\dsp_signed_mac_18_13_23_32'.
Removed a total of 0 cells.

4.3. Executing OPT_MUXTREE pass (detect dead branches in mux trees).
Running muxtree optimizer on module \dsp_signed_mac_18_13_23_32..
  Creating internal representation of mux trees.
  Evaluating internal representation of mux trees.
  Analyzing evaluation results.
Removed 0 multiplexer ports.
<suppressed ~7 debug messages>

4.4. Executing OPT_REDUCE pass (consolidate $*mux and $reduce_* inputs).
  Optimizing cells in module \dsp_signed_mac_18_13_23_32.
Performed a total of 0 changes.

4.5. Executing OPT_MERGE pass (detect identical cells).
Finding identical cells in module `\dsp_signed_mac_18_13_23_32'.
Removed a total of 0 cells.

4.6. Executing OPT_DFF pass (perform DFF optimizations).
Adding SRST signal on $procdff$32 ($dff) from module dsp_signed_mac_18_13_23_32 (D = $procmux$15_Y, Q = \input_valid, rval = 1'0).
Adding EN signal on $auto$ff.cc:262:slice$39 ($sdff) from module dsp_signed_mac_18_13_23_32 (D = \i_valid, Q = \input_valid).
Adding SRST signal on $procdff$33 ($dff) from module dsp_signed_mac_18_13_23_32 (D = $procmux$10_Y, Q = \result_valid, rval = 1'0).
Adding EN signal on $auto$ff.cc:262:slice$41 ($sdff) from module dsp_signed_mac_18_13_23_32 (D = \input_valid, Q = \result_valid).
Adding SRST signal on $procdff$34 ($dff) from module dsp_signed_mac_18_13_23_32 (D = $procmux$5_Y, Q = \output_valid, rval = 1'0).
Adding EN signal on $auto$ff.cc:262:slice$43 ($sdff) from module dsp_signed_mac_18_13_23_32 (D = \result_valid, Q = \output_valid).
Adding SRST signal on $procdff$35 ($dff) from module dsp_signed_mac_18_13_23_32 (D = \ax, Q = \reg_ax, rval = 18'000000000000000000).
Adding SRST signal on $procdff$36 ($dff) from module dsp_signed_mac_18_13_23_32 (D = \ay, Q = \reg_ay, rval = 13'0000000000000).
Adding SRST signal on $procdff$37 ($dff) from module dsp_signed_mac_18_13_23_32 (D = \az, Q = \reg_az, rval = 23'00000000000000000000000).
Adding SRST signal on $procdff$38 ($dff) from module dsp_signed_mac_18_13_23_32 (D = $add$/home/zhigang/raw_data/raw_designs/vtr_designs/verilog/koios/clstm_like.medium_submodules/dsp_signed_mac_18_13_23_32.v:29$3_Y, Q = \reg_res, rval = 0).

4.7. Executing OPT_CLEAN pass (remove unused cells and wires).
Finding unused cells or wires in module \dsp_signed_mac_18_13_23_32..
Removed 10 unused cells and 27 unused wires.
<suppressed ~11 debug messages>

4.8. Executing OPT_EXPR pass (perform const folding).
Optimizing module dsp_signed_mac_18_13_23_32.

4.9. Rerunning OPT passes. (Maybe there is more to do..)

4.10. Executing OPT_MUXTREE pass (detect dead branches in mux trees).
Running muxtree optimizer on module \dsp_signed_mac_18_13_23_32..
  Creating internal representation of mux trees.
  No muxes found in this module.
Removed 0 multiplexer ports.

4.11. Executing OPT_REDUCE pass (consolidate $*mux and $reduce_* inputs).
  Optimizing cells in module \dsp_signed_mac_18_13_23_32.
Performed a total of 0 changes.

4.12. Executing OPT_MERGE pass (detect identical cells).
Finding identical cells in module `\dsp_signed_mac_18_13_23_32'.
Removed a total of 0 cells.

4.13. Executing OPT_DFF pass (perform DFF optimizations).

4.14. Executing OPT_CLEAN pass (remove unused cells and wires).
Finding unused cells or wires in module \dsp_signed_mac_18_13_23_32..

4.15. Executing OPT_EXPR pass (perform const folding).
Optimizing module dsp_signed_mac_18_13_23_32.

4.16. Finished OPT passes. (There is nothing left to do.)

5. Printing statistics.

=== dsp_signed_mac_18_13_23_32 ===

   Number of wires:                 18
   Number of wire bits:            244
   Number of public wires:          16
   Number of public wire bits:     180
   Number of memories:               0
   Number of memory bits:            0
   Number of processes:              0
   Number of cells:                  9
     $add                           32
     $mul                           32
     $sdff                          86
     $sdffe                          3

End of script. Logfile hash: 3181d17ade, CPU: user 0.02s system 0.00s, MEM: 11.48 MB peak
Yosys 0.10+12 (git sha1 72fac04, gcc 7.4.0-1ubuntu1~16.04~ppa1 -fPIC -Os)
Time spent: 24% 4x opt_expr (0 sec), 24% 3x opt_merge (0 sec), ...
